Unnamed: 0,Question,A,B,C,D,Answer,Subject,Subcategory
98,根据凯恩斯经济理论，,美国联邦储备委员会 (FED) 不应采取货币政策。,货币供应量的变化会产生重大影响。,财政政策是使总需求曲线移动的首选方法。,美国联邦储备委员会 (FED) 应允许货币供应量以恒定的速度增长。,C,high_school_macroeconomics,economics
177,如果……，部分准备金银行制度创造货币的能力就会减弱。,借款家庭将全部贷款金额转存回银行,银行持有超额准备金,银行将多余的准备金全部借给借款客户,家庭增加在银行的支票存款,B,high_school_macroeconomics,economics
333,以下哪位可以被视为失业人员？ I. 辞职另谋高就的 Mary。 II. 45 岁退休，实现了自己梦想的 John。III. 做着兼职工作但希望从事全职工作的 Diane。,仅 I,仅 II,只有 III,I 和 III,A,high_school_macroeconomics,economics
173,以下哪一种商品的需求曲线可能最有弹性？,对白色福特厢式旅行车的需求,对汽车的需求,对福特汽车的需求,对美国制造汽车的需求,A,high_school_microeconomics,economics
77,一个因变量的值在一定范围外是不可观测的，但自变量的相应值仍然是可用的，则最准确地描述为哪种变量？,删失,截断,多项变量,离散选择,A,econometrics,economics
84,一位美国人购买了一套在中国生产的娱乐系统。那么美国国民收入账户将如何处理这笔交易？,净出口和 GDP 均增加。,净出口和 GDP 均减少。,净出口与 GDP 的走向相反。,净出口减少，GDP 不变。,B,high_school_macroeconomics,economics
180,国债增加对美元市场以及美元相对于其他货币的价值有何影响？美元市场     美元价值,需求增加     升值,供给增加     升值,供给减少     贬值,需求减少     贬值,A,high_school_macroeconomics,economics
322,Ceteris paribus,是希腊语，意思是“永不改变”。,的意思是任何事情都可能随时发生变化。,是拉丁语，意思是“其他一切保持不变”。,的意思是“当处于平衡状态时”。,C,high_school_macroeconomics,economics
78,Hausman 测试将用于,确定作为同步系统一部分的方程是否被识别,确定特定变量是否需要同步框架,确定 2SLS 或 ILS 是最优的,确定结构形式方程是否可以通过简化形式的替换得到,B,econometrics,economics
66,若对包含 4 个变量的系统应用 2 个协整向量的零假设的 Johansen“跟踪”检验，则在检验中使用哪些特征值？,全部,最大的 2,最小的 2,第二大,C,econometrics,economics
255,根据凯恩斯主义分析，大萧条是由……造成的。,支出不足,边际消费倾向的急剧上升,过多投资,外国对经济的影响过大,A,high_school_macroeconomics,economics
67,如果货币供应量增加，那么货币市场会发生什么情况（假设货币需求曲线向下倾斜）？,名义利率上升。,名义利率下降。,名义利率没有变化。,货币的交易需求下降。,B,high_school_macroeconomics,economics
365,根据货币主义理论，,联邦储备委员会 (FED) 应积极采取货币政策。,货币供应量的变化不会产生重大影响。,财政政策是使总需求曲线移动的首选方法。,美国联邦储备委员会 (FED) 应允许货币供应量以恒定的速度增长。,D,high_school_macroeconomics,economics
33,下列哪一个因素可能导致相对较高的样本外预测准确度？,一个基于金融理论的模型,包含许多变量的模型,因变量最近表现出结构变化的模型,完全是统计性质的模型，没有预测判断性修正的余地,A,econometrics,economics
112,相对自由或容易进入（低或不存在进入壁垒）与以下哪项最匹配？,更多的消费者选择，更大的需求价格弹性，更多的竞争者。,更多的消费者选择，更低的需求价格弹性，更多的竞争者。,更多的消费者选择，更大的需求价格弹性，更少的竞争对手。,更少的消费者选择，更低的需求价格弹性，更少的竞争者。,A,high_school_microeconomics,economics
246,紧缩性货币政策会使名义利率、总需求、产出和价格水平发生什么变化？名义利率     总需求     产出     价格水平,下降     上升     上升     上升,下降     下降     下降     上升,上升     下降     下降     上升,上升     下降     下降     下降,D,high_school_macroeconomics,economics
224,劳动需求曲线源自,市场劳动需求曲线,劳动生产的产出的需求曲线,企业的劳动供给曲线,劳动市场的均衡工资,B,high_school_microeconomics,economics
118,如果劳动总产量正在以越来越快的速度增长，,劳动边际产量在上升。,劳动边际产量处于最小值。,劳动边际产量处于最大值。,边际成本正在上升。,A,high_school_microeconomics,economics
106,货币主义者认为，V 和 Q 是,不变的。,稳定的。,可变的。,对于理解货币如何影响经济并不重要。,B,high_school_macroeconomics,economics
167,下列哪一项代表了企业的垄断定价或市场支配力的度量，即指数的值越大，企业的市场定价能力越大？,(MC-P)/MC,(MC-P)/P,(P-MC)/P,(P-MC)/MC,C,high_school_microeconomics,economics
15,Ray 和 Dorothy 都会做饭，并且也都可以在星期六下午在花园里拔草。对于做饭的每一个小时，Ray 可以拔 50 根草，Dorothy 可以拔 100 根草。基于这些信息，,Ray 拔草，因为他在做饭方面有绝对优势。,Dorothy 拔草，因为她在做饭方面有绝对优势。,Dorothy 做饭，因为她在做饭方面有比较优势。,Ray 做饭，因为他在做饭方面有比较优势。,D,high_school_microeconomics,economics
10,"在下列哪种情况下，自助抽样法优于纯模拟？

i) 若希望实验数据的分布特性

与某些实际数据的分布特性相同


ii) 若希望确切地知道实验中

数据的分布特性


iii) 若实际数据的分布特性未知


iv) 若可用的实际数据样本非常小",仅 (ii) 和 (iv),仅 (i) 和 (iii),仅 (i)、(ii) 和 (iv),仅 (i)、(ii)、(iii) 和 (iv),B,econometrics,economics
230,假设实际 GDP 增加。我们可以毫无疑问地得出,价格上涨的结论。,就业率提高的结论。,生产力提高的结论。,价格和/或产出提高的结论。,C,high_school_macroeconomics,economics
65,房子的价格最好用哪种数字来描述？,离散,基数,序数,标称数,B,econometrics,economics
104,性别差距可能与男性/女性在以下方面的差异有关,荷尔蒙,危险行为和职业,吸烟比例,以上皆是,D,human_aging,health
138,一名以前健康的 27 岁男性发现阴茎上有三个无触痛的病变，4 周后他去看医生。他说这些病变大小没有变化。他与多个男性和女性伴侣有性行为，并且不定期使用避孕套。他不服用任何药物。社交场合他会喝两到五瓶啤酒。他偶尔吸食大麻。他的体温是 36.9°C (98.4°F)。无淋巴结病变。检查显示阴茎中轴有三个直径 10 毫米的无蒂、肉色病变。在稀释的醋酸溶液作用下，病变变白。其余检查未见异常。下列哪种后续治疗措施最合适？,口服阿昔洛韦治疗,口服多西环素治疗,青霉素肌内注射治疗,冷冻疗法,D,professional_medicine,health
88,在欧洲，哪些药物获批上市用于治疗肥胖？,奥利司他,芬特明/托吡酯,Lorcaserin,纳曲酮/安非他酮,A,nutrition,health
34,接手照顾生命只剩 6 个月或不到 6 个月的人，试图让他们待在家里，为他们提供止痛药，并终止所有延长生命的手段，这样的计划被称为,安乐死,冷冻疗法,医疗保险,临终关怀,D,human_aging,health
192,一名 33 岁的女性因为轻度恶心、尿频尿急和便秘两天而来就诊。她还在过去两周内体重减轻了 4.5 千克（10 磅）并有 3 周的阴道出血史。盆腔检查显示宫颈结节，后唇不规则且易碎，以及一个坚硬、不规则、固定的盆腔肿块，横跨骨盆。宫颈和阴道前壁活检标本检查显示分化良好的角化鳞状细胞癌。下列哪项最能描述该患者疾病的发病机制？,p53 基因失活,病毒启动子插入到细胞生长因子基因旁,特殊转导,TAX 对细胞生长因子基因的反式激活,A,professional_medicine,health
137,未得到治疗的龋齿估计全球患病率是多少？,20%,40%,60%,80%,B,nutrition,health
111,组装是病毒复制的重要后期阶段，通常需要下列哪项完成该阶段？,使用细胞核和细胞质中的细胞支架,夺取细胞的脂质和膜,病毒基因组中嵌入的总体计划,细胞和病毒蛋白之间的随机相互作用,A,virology,health
109,一位 55 岁男性因为持续两周出现的复发性广泛水泡形成而前往医生处。体检显示病变多见于弯曲部位，包括腋窝和腹股沟。水泡不容易破裂，没有口腔病变。这些水泡最有可能是下列哪种物质粘附失败引起的？,基底膜,真皮乳头,朗格汉斯细胞,黑素细胞,A,professional_medicine,health
37,一位 37 岁的艾滋病 (AIDS) 女性患者因有 1 个月的进展性腹泻和 1.8 公斤（4 磅）体重减轻来就诊。过去一周，她每天排出六次大量稀便。她目前正在接受三联抗逆转录病毒治疗。她是一名空姐，定期在美国国内航班工作。她每月飞往亚洲至少一次。她身高 163 厘米（5 英尺 4 英寸），体重 59 公斤（130 磅）；BMI 是 22 kg/m²。患者体温 37°C（98.6°F），脉搏 88 次/分钟，血压 112/64 mm Hg。腹部平坦。其余检查无异常。CD4+ T 淋巴细胞计数为 400/mm³（正常值≥500）。下列哪种是最可能的致病微生物？,隐孢子虫,巨细胞病毒,鸟-胞内分枝杆菌复合体,肠炎沙门氏菌,A,professional_medicine,health
136,关于手臂反射的评估，下列哪项是正确的？,肱二头肌反射的根值是 C5、C6,若轻拍肌腱时没有反射，则记录为缺失,肱三头肌腱在肘前窝受到撞击,手指剧烈抽搐证实下运动神经元损伤,A,clinical_knowledge,health
64,如果男性运动员在训练期间的平均耗氧率为 2 l/min，则他的能量消耗率大概是：,400 kJ/min。,200 kJ/min。,80 kJ/min。,40 kJ/min。,D,college_medicine,health
112,HIV 传播给婴儿最大单一决定因素是：,母亲的年龄,母亲的病毒载量,母亲的免疫状态,父亲的病毒载量,B,virology,health
156,关于评价人类营养中蛋白质质量的方法，以下哪种说法是正确的？,大鼠蛋白质功效比值试验 (PER) 是评估人类营养蛋白质质量的良好方法。,大鼠净蛋白利用试验 (NPU) 是评估人类营养蛋白质质量的最佳方法。,动物生长试验低估了作为人类营养的饮食蛋白质质量,发育中的大鼠是评价人类营养中蛋白质质量的良好模型。,C,nutrition,health
135,双盲研究的目的是：,实现治疗和未治疗受试者的可比性,降低抽样变异的影响,避免观察者和受试者偏倚,避免观察者偏倚以及抽样变异,B,virology,health
119,客观人格测验的一个例子是,主题统觉测验 (TAT),明尼苏达多相人格测验 (MMPI),罗夏墨迹测验,麦克亚当斯水平测验,B,human_aging,health
62,顺利跑完马拉松的关键要素是：,优势。,体能。,步幅长度。,耐力。,D,college_medicine,health
83,下列哪项被认为与多次冲刺活动中外周肌疲劳的发展有关？,无机磷酸盐的积累。,肌肉中高渗透压的发展。,过量的抗氧化物。,缺钾。,A,college_medicine,health
122,下列哪项正确？,每天每公斤体重增加 3 克以上的蛋白质摄入量会刺激肌肉生长，增加力量。,肌酸补充剂可以增加肌肉的强度和力量。,氨基酸补充剂可以增加肌肉的强度和力量。,肌肉损伤是由缩短收缩引起的。,B,college_medicine,health
182,如果一名健康女性的平均每日总能量摄入量为 9279 kJ，粪便和尿液的能量含量分别为 647 kJ 和 318 kJ。那么其平均每日可消化能量摄入量和可代谢能量摄入量分别为：,647 kJ 和 318 kJ,9279-318 kJ 和 9279-647 kJ,9279 + 318 kJ 和 9279 + 647 kJ,9279-647 kJ 和 9279- (647 + 318) kJ,D,nutrition,health
17,对同居老年人的调查表明，他们倾向于将同居视为,迈向最终婚姻的第一步,婚姻的替代品,节省开支的一种方式,他们的绝唱,B,human_aging,health
148,根据依恋理论，在心理学研究过程中，下列哪种儿童最有可能依附于一名之前不认识的男性心理学家?,在安全、稳定环境中长大的两个月大女婴。,在安全、稳定环境中长大的五个月大男婴。,由一名经常忽视他的照护者抚养的八个月大男婴。,由两名偶尔忽视她的照护者抚养的十三个月大女婴。,A,college_medicine,health
106,晚年神经质的增加可有力地预测______,死亡率,社会支持的丧失,认知能力下降,独立性,A,human_aging,health
232,严格素食母亲所生的婴儿的哪种营养素缺乏的风险会增加？,维生素 C,叶酸,维生素 B12,钙,C,nutrition,health
248,一名 72 岁的女性，过去 38 年每天吸烟 20 支，开始使用眼药水治疗青光眼。三天后，她在上楼梯时气短明显加重。下列哪种药物最有可能导致该患者出现气短？,阿拉可乐定,肾上腺素,拉坦前列素,噻吗洛尔,D,professional_medicine,health
38,投射测验一般比客观人格测验____。,可靠性更高,更直观,更有效,提供更多信息,B,human_aging,health
185,正在进行一项研究，以评估造船厂工人中的间皮瘤。一家大型造船厂提供了过去 50 年中所有员工接触石棉的记录。工人的健康保险公司提供的索赔数据记录了当前工人及退休人员的所有胸部 X 光片和间皮瘤的诊断。研究招募了被诊断为间皮瘤的造船厂工人和未被诊断为间皮瘤的造船厂工人。研究中的所有受试者都必须进行胸部 X 光检查。要选择一个进行过胸部 X 光检查的对照组，下列哪个理由最好？,解决混杂变量,证明因果关系,尽量减少评估偏倚,减少回忆偏倚,C,professional_medicine,health
85,丙酮酸脱氢酶复合物：,位于肌质中。,催化丙酮酸转化为乙酰辅酶 A。,催化丙酮酸转化为乳酸。,催化乳酸转化为丙酮酸。,B,college_medicine,health
16,DNA 转录为信使 RNA 分子的过程发生在：,核糖体上。,细胞质中。,细胞核中。,仅细胞分裂期间。,C,college_medicine,health
85,______是一组可观察到的特征的，是遗传和环境影响的总和。,基因型,表现型,基因型和表现型,既非基因型也非表现型,B,medical_genetics,health
70,提供 TMJ 位置信息的本体感受器主要集中于,TMJ 的关节囊和韧带以及翼内肌。,TMJ 的关节囊和韧带以及翼外肌。,TMJ 的关节盘以及翼内肌。,TMJ 的关节盘以及翼外肌。,B,anatomy,health
186,在从事过桥梁工作的人中，有多大比例的人认为桥梁工作比他们的职业工作更好？,不到 25%,不到 50%,超过 50%,超过 75%,C,human_aging,health
68,在左心室收缩之间，血液继续在血管中流动，因为：,心房在收缩。,血管收缩了。,右心室放松。,动脉有弹性后坐力。,D,clinical_knowledge,health
153,在过去的二十年期间，随着流行病学研究发现显示早期经历和后期健康之间的联系，学界对孕妇营养的关注度也增加。以下哪种说法是正确的：,尽管生命早期因素似乎很重要，但与心血管疾病和 2 型糖尿病风险的联系多可用成人生活方式来解释,仅有英国研究观察到早期经历和后期健康之间存在联系,流行病学证据显示，生理程序化差异仅与出生前事件相关,流行病学证据显示，生理程序化差异与出生前和出生后早期事件相关,D,nutrition,health
226,在一个完整的三羧酸循环（Krebs 循环）中形成多少 CO2 和 ATP 分子？,2CO2 和 2ATP,2CO2 和 16ATP,2CO2 和 12ATP,2CO2 和 1ATP,D,clinical_knowledge,health
210,一名 47 岁的男子在突然发生严重的枕部头痛和颈部僵硬后 12 小时来看医生。他没有其他症状，也没有严重头痛的病史。他有高血压和胃食管反流病。目前正在服用氢氯噻嗪和雷尼替丁。他能分辨人、地点和时间。体温为 36.7°C（98.1°F），脉搏为 100 次/分，血压为 160/90 mm Hg。颈部因疼痛活动范围减少。神经系统检查未见局灶性异常。下列哪项是最可能的诊断？,丛集性头痛,脑膜炎,偏头痛,蛛网膜下腔出血,D,professional_medicine,health
47,乳头瘤病毒会引起疣和癌症，其感染人类的最常见途径是什么？,通过水传播,通过空气传播,通过划伤或破损的皮肤,属于院内感染，在医院内传播,C,virology,health
151,即使是少量的睡眠剥夺似乎也会,增加体重,提高睡眠质量,扰乱第二天的注意力,增加易怒性,B,human_aging,health
140,下列哪一项不是管制药物？,30 毫克安瓿注射用磷酸可待因。,一个吗啡缓释片。,12.5 微克芬太尼贴片。,一瓶 500 毫升的吗啡，10 毫克，5 毫升口服混悬液。,D,clinical_knowledge,health
29,关于房室束，下列哪项陈述是正确的？,由自主神经细胞突构成，是心房和心室之间的唯一电连接通路。,由浦肯野纤维构成，是心房和心室之间的唯一电连接通路,由自主神经细胞突构成，是心房和心室之间的电连接通路之一。,由浦肯野纤维构成，是心房和心室之间的电连接通路之一。,B,anatomy,health
68,一名患有活动性强直性脊柱炎的 46 岁女性来办公室进行随访检查。使用各种常规的非甾体抗炎药无效。柳氮磺胺吡啶治疗也没有改善。最合适的后续治疗是使用一种抑制下列哪种物质的药物？,细胞毒性 T 淋巴细胞抗原 4,表皮生长因子,白细胞介素-1（IL-1）,肿瘤坏死因子α,D,professional_medicine,health
154,基因掺杂(gene doping)这个词是指：,利用药物来改变基因转录。,利用基因操纵技术来提高运动成绩。,通过激活或抑制基因来掩盖运动员服用药物。,使用药物修饰肌肉抑制生长基因。,B,clinical_knowledge,health
27,关于转氨作用，以下哪种说法是正确的？,只有非必需（可有可无）氨基酸发生转氨作用。,转氨作用是氨基酸分解代谢过程中的不可逆性反应。,转氨酶需要来源于维生素 B12 的辅酶。,转氨酶需要来源于维生素 B6 的辅酶。,D,nutrition,health
170,下列哪种陈述是错误的？,磷酸果糖激酶是糖酵解的限速酶。,II 型纤维的磷酸化酶活性高于 I 型纤维。,耐力训练增加肌肉中 TCA 循环酶的数量。,氧在 TCA 循环中被消耗。,D,college_medicine,health
30,下列哪项术语描述的是前臂向身体弯曲的运动？,外展,外翻,屈曲,旋前,C,anatomy,health
204,对于周围神经病变，以下哪项是正确的？,袜子分布证实的感觉缺失,双腿两侧的紧实度增加,强化后的反射非常快,肌无力近端比远端更明显,A,clinical_knowledge,health
262,一名 52 岁的女性来看诊，主诉左乳头有绿色分泌物。没有外伤或发热史，患者目前未使用口服避孕药，也未进行激素替代疗法。她上次怀孕大约是在 20 年前。体检正常，只有乳头有绿色分泌物。此患者的症状最可能的原因是,乳腺癌,纤维囊性疾病,乳腺管扩张症,垂体腺瘤,C,professional_medicine,health
129,一名摔跤手为了迎接十二月的比赛，计划在两个月内减重 30 磅。下列哪种方法不是限制热量摄入的好方法？,在健康果昔店而不是咖啡店学习。,每周六达成热量目标后奖励自己一顿美味的饭菜。,吃高热量零食时用橡皮筋弹自己。,将零食藏在家里看不到的地方。,D,college_medicine,health
93,"桑拿有时称为“桑拿浴”，其特点是短期被动暴露在极端高温下。这种暴露会引起轻度的体温过高（即体内核心温度的升高），从而引发包括神经内分泌、心血管和细胞保护机制在内的温度调节反应，这些机制共同作用以恢复体内平衡并使身体对未来的热应激进行调节……近几十年来，基于来自观察、介入和机制研究的有力数据，桑拿浴已成为一种增加寿命和改善整体健康的手段。特别值得关注的是对库奥皮奥缺血性心脏病危险因素研究 (KIHD) 参与者的研究结果，这是一项正在进行的针对健康结局的基于人群前瞻性队列研究，涉及来自芬兰东部的 2300 多名中年男性，结果发现桑拿与死亡和疾病的减少之间存在紧密联系……KIHD 研究发现，每周蒸桑拿两至三次的男性因心血管相关原因死亡的可能性比不蒸桑拿的男性低 27%。[2] 此外，研究发现他们所获得的益处具有剂量依赖性：每周蒸桑拿约四至七次的男性，获得的益处约为两倍——因心血管相关原因死亡的可能性减少了 50%。[2]此外，频繁蒸桑拿的人员因各种原因过早死亡的可能性减少了 40%。即使考虑到年龄、活动水平和可能影响男性健康的生活方式因素，这些结果依然成立……KIHD 还表明，频繁蒸桑拿能剂量依赖性地降低患痴呆症和阿尔茨海默病的风险。与每周仅用一次桑拿的男性相比，每周蒸桑拿两至三次的男性患痴呆症的风险降低了 66%，患阿尔茨海默病的风险降低了 65%……与蒸桑拿相关的健康益处还扩展到心理健康的其他方面。无论饮食习惯、社会经济地位、体育活动和炎症状态如何，参与 KIHD 研究的每周蒸桑拿四至七次的男性患精神障碍的可能性降低了 77%（通过C反应蛋白测量）……暴露于高温会给身体带来应激，诱发快速而强烈的反应。皮肤和核心体温显著上升，并开始出汗。皮肤首先升温，升至 40°C（104°F），然后核心体温发生变化，缓慢升高从 37°C（98.6°F, 或正常温度）到 38°C（100.4°F），然后迅速升至 39°C（102.2°F）……心输出量（即衡量心脏根据身体需氧量所执行工作的量）增加了 60% 到 70%，而心率（每分钟的心跳次数）增加，心搏出量（泵送的血量）保持不变。[5]在此期间，身体约 50% 到 70% 的血流量从核心重新分配到皮肤以促进出汗。普通人蒸桑拿时失去大约 0.5 公斤的汗水。[11]急性热暴露还会引起整体血浆容量的短暂增加，以减轻核心血容量的减少。血浆容量的增加不仅为出汗提供了储备液源，还像汽车散热器中的水一样，冷却身体以防止核心体温快速升高并促进耐热性……反复蒸桑拿使身体适应热量，并优化身体对未来接触热量的反应，这可能是由于一种称作顺势疗法的生物现象，即暴露于轻度应激后产生的与应激强度不成比例的补偿性防御反应。顺势疗法触发了大量保护机制，这些机制不仅能修复细胞损伤，还能在随后暴露于更具破坏性的应激时提供保护……蒸桑拿的生理反应与中至高强度运动期间的生理反应非常相似。实际上，蒸桑拿已被提出作为因慢性病或身体限制无法从事体育活动的人员的替代方案。[13]

下列哪段可能是本文章节选之后的段落？",关于一种在对热反应中促进细胞内功能的蛋白质的段落。,关于爱斯基摩人心脏病发作增加的段落。,关于芬兰水球队杰出表现回顾的段落。,关于暴露在高温下老鼠研究的段落。,A,college_medicine,health
116,下列哪项与呼吸功的增加无关？,呼吸频率上升。,呼吸作响。,增加使用辅助呼吸肌。,呼吸频率为每分钟 16 次。,D,clinical_knowledge,health
207,以下哪一种推荐用于清洁口腔？,过氧化氢。,水。,柠檬和甘油拭子。,生理盐水。,B,clinical_knowledge,health
157,哪个最能描述巨石阵？,巨石纪念碑,哈拉菲纪念中心,查文仪式纪念碑,美索不达米亚纪念碑,A,prehistory,history
94,"本问题涉及以下信息。
“就像世界上任何其他种族一样，我们是人；我们有灵魂，我们有激情，我们有感觉，我们有希望，我们有欲望。今天全世界都在呼喊：加拿大为加拿大人呐喊，美国为美国人呐喊，英国为英国人呐喊，法国为法国人呐喊，德国为德国人呐喊——你认为我们这些世界上的黑人，让非洲为非裔呐喊是不合理的吗？”
——马库斯·加维，1920 年
这段话最好被理解为",支持限制移民进入美国的论点。,试图团结工人阶级的非裔美国人和白人男女。,黑人民族主义的表达。,为促进非裔美国人在工业上的进步而设计的小册子。,C,high_school_us_history,history
223,世界上最早的文明是在哪里产生的？,中国东部,克里特岛,埃及,美索不达米亚,D,prehistory,history
