Question_ZH-PY,A_ZH-PY,B_ZH-PY,C_ZH-PY,D_ZH-PY,Answer_ZH-PY,Subject_ZH-PY,Subcategory_ZH-PY
ren xue hong dan bai fen zi de an ji suan xu lie yu hei xing xing xue hong dan bai de xiang si xing bi yu gou xue hong dan bai de xiang si xing geng gao 。 zhe zhong xiang si xing biao ming ，,ren yu gou de qin yuan guan xi bi ren yu hei xing xing de qin yuan guan xi geng jin,ren yu da xing xing de qin yuan guan xi bi ren yu gou de qin yuan guan xi geng jin,ren yu hei xing xing you qin yuan guan xi ， dan yu quan wu qin yuan guan xi,ren he hei xing xing fei chang xiang si,B,high_school_biology,biology
yan jiu cong shou jing luan jie duan dao tai er jie duan de ji zhui dong wu fa yu de pei tai xue jia you li you de chu yi xia na xiang jie lun ？,ge ti fa yu chong yan xi tong fa yu 。,zao qi pei tai zhan shi le qi gang 、 mu he zhong de xiang tong te zheng 。,zao qi ren lei pei tai yu zao qi yu lei he niao lei pei tai you gong tong te zheng 。,ren lei pei tai zai fa yu guo cheng zhong xian shi chu cheng nian yu lei he niao lei de te zheng 。,A,college_biology,biology
yi xia na xiang bu shi fang zhi zhong jian fan zhi de shi li,qian zai pei ou chu xian di li ge li,qian zai pei ou chu xian xing wei ge li,qian zai pei ou qiu ai yi shi bu tong,qian zai pei ou fan zhi ji jie xiang si,D,high_school_biology,biology
xi bao diao wang shi cheng xu xing xi bao si wang ， shi sheng wu ti de yi ge bi yao guo cheng 。 guan yu xi bao diao wang ， yi xia na xiang bu zheng que ？,sui ji fa sheng 。,zai sheng wu ti bu zai xu yao shi ， te ding xi bao si wang 。,ji lei le tai duo tu bian shi ， xi bao hui diao wang 。,zhi wu xi bao bei ji sheng chong gan ran shi ， diao wang hui zuo wei fang yu cuo shi 。,A,high_school_biology,biology
dao zhi ye sheng mao he xun hua mao bu tong ban wen de ji yin ye hui dao zhi zhe xie mao chu xian jiao cha yan （ xie shi ）， jiao cha yan lve wei shi ying bu liang 。 jia she yu jiao cha yan xiang guan de ban wen mo shi ju you gao du shi ying xing ， jie guo shi mao zhong qun de ban wen mo shi he jiao cha yan jun sui shi jian zeng jia 。 zhe xie guan cha jie guo ke zhi chi yi xia na zhong shuo fa ？,jin hua shi jian jin de ， qing xiang yu jin hua wei geng wan mei de zhong qun 。,biao xing tong chang shi zhe zhong de jie guo 。,zi ran xuan ze hui sui shi jian jian shao zhong qun zhong shi ying bu liang ji yin de pin lv 。,duo ji yin yi chuan yi ban shi ying bu liang ， hou dai zhong ying gai bu tai chang jian 。,B,high_school_biology,biology
jia xi xin xi zhi chi yi xia na zhong shuo fa ？,P  dai mu ti wei  X-X。,P  dai fu qin wei  X-Y。,ru guo di  II  dai de fu mu  1  he  2  sheng le ling yi ge hai zi ， hai zi huan niao hei suan niao zheng de ji lv wei  25%。,nv xing  1  de ji yin xing wei  X-X。,C,high_school_biology,biology
yi ge  DNA  fen zi de he gan suan xu lie wei  5′-C-a-T-3′。 zai dan bai zhi he cheng guo cheng zhong ， ju you hu bu mi ma zi de  mRNA  fen zi cong  DNA  zhuan lu ， yi ge  tRNA  yu  mRNA  mi ma zi pei dui 。 ci  tRNA  fan mi ma zi de he gan suan xu lie shi shen me ？,5′-G-T-A-3′,5′-G-U-A-3′,5′-C-A-U-3′,5-′U-A-C-3′,C,high_school_biology,biology
lan zao yu dan xi bao lv zao you he bu tong ？,lan zao huan yuan liu hua he wu 。,lan zao mei you xi bao bi 。,lan zao mei you xi bao he 。,lv zao chan sheng xi bao mo 。,C,college_biology,biology
zai shi yan shi shi jian lian xi zhong ， yi ming xue sheng qie xia zhi wu ye pian pan zhuang bu fen ， bing jiang qi fang ru zhuang you shui de shao bei zhong 。 zai shui zhong jia ru yi di fei zao yi bang zhu jin mo ye pian 。 fei zao bang zhu jin mo ye pian pan zhuang bu fen de fang shi shi shen me ？,fei zao fen zi jing ye pian qi kong jin ru ， bing yu yang fen zi jie he 。,fei zao fen zi yu ye pian biao mian qi pao jie he ， bing jiang qi qu chu 。,fei zao fen zi jiang di le shui de  pH  zhi ， yi bian guo liang  H +  yu ye mian jie he 。,fei zao fen zi shu shui qu yu fu zhuo yu la zhi ye mian ， er qin shui qu yu yu shui fen zi xing cheng qing jian 。,D,high_school_biology,biology
yi xia suo you wu zhi dou ke neng cun zai yu jie di zu zhi zhong ， chu le,ning xue mei,tang an ju tang,jiao yuan dan bai,cheng xian wei xi bao,A,college_biology,biology
huan jie dong wu he jie zhi dong wu xiang si zhi chu zai yu liang men de cheng yuan dou,ju you fen jie de shen ti,ju you feng bi de xun huan xi tong,tong guo shi run de mo kuo san jin xing qi ti jiao huan,ju you fa da de gan jue qi guan,A,college_biology,biology
jin guan tu bian fa sheng lv you gui lv xing qie ke yu ce ， dan yi xia na zhong shuo fa zui bu ke neng shi tu bian pin lv si hu jiao di de yuan yin ？,yi xie tu bian chan sheng de deng wei ji yin shi yin xing de ， ke neng bu hui biao da 。,yi xie bu liang biao xing xing zhuang ke neng wu fa fan zhi 。,yi xie tu bian hui yin qi fei chang ju lie de biao xing bian hua ， dao zhi ji yin ku zhong jiang qi yi chu 。,ke yu ce de tu bian fa sheng lv dao zhi ji yin ku chi xu bian yi 。,D,high_school_biology,biology
zai zhen jun zhong ， xi bao bi you yi xia na zhong wu zhi jia gu ？,ji ding zhi,gui,mu zhi su,jiao yuan xian wei,A,college_biology,biology
fei zhou fei yu chang sheng huo zai bu liu dong de xiao dan shui chi zhong 。 qi sai jian shao ， yu qi ta yu lei de bu tong zhi chu shi hu xi kong qi 。 bu tong zhi chu hai bao kuo fei zhou fei yu pai chu de dan fei wu wei niao su er bu shi an 。 yi xia na zhong shuo fa zheng que di jie shi le zhe ru he dui fei yu you li ？,niao su bu rong yu shui bing chen yu xiao shui chi di bu 。 yin ci ， yu yu you du wu zhi fen ge kai 。,an you ju du ， hui wei ji qi xi zai xiao shui chi zhong de fei yu 。,xiao shui chi zhong de qi ta yu ke shi yong niao su zuo wei neng yuan lai yuan 。,ju du niao su shi xiao shui chi bu shi he jing zheng dui shou sheng cun 。,B,high_school_biology,biology
yi xia na xiang dao zhi gen ju tong yuan dan bai de an ji suan xu lie que ding bu tong wu zhong jin hua xiang guan xing de zhun que xing tong chang bu ru gen ju tong yuan ji yin de he gan suan xu lie que ding xiang guan xing ？,chen mo tu bian,ji yin chong fu,gai bian ji yin xu lie de yi wei shi jian,jiao cha hu huan,A,high_school_biology,biology
zai yi xiang shi yan zhong ， dui liang qi dong wu shou jing luan de di yi ge luan lie mian jin xing le chu li ， shi de hui se xin yue ti zhi cun zai yu di yi ci luan lie chan sheng de liang ge luan lie qiu zhong de yi ge zhong 。 ran hou jiang liang ge luan lie qiu fen li 。 luan lie qiu de yu qi jie ju shi shen me ？,dai you hui se xin yue ti de luan lie qiu hui bi mei you hui se xin yue ti de luan lie qiu geng kuai sheng zhang 。,dai you hui se xin yue ti de luan lie qiu hui xing cheng yi ge wan zheng dan jiao xiao de pei tai 。,mei you hui se xin yue ti de luan lie qiu hui xing cheng yi ge wan zheng dan jiao xiao de pei tai 。,dai you hui se xin yue ti de luan lie qiu hui zai di er ci luan lie qian ting zhi fen lie bing si wang 。,B,college_biology,biology
yi xia na xiang bu zheng que,jia zhuang xian su ke zeng jia dai xie lv,yi dao su ke jian shao tang yuan chu cun,jia ya su ke ci ji shen zang dui shui de zhong xi shou,shen shang xian su ke zeng jia xue tang shui ping he xin lv,B,high_school_biology,biology
yi zhi hui se yu mao gong ji he yi zhi biao xing xiang tong de mu ji chan xia  17  zhi hui se 、7  zhi hei se he  8  zhi bai se chu ji 。 zhe xie ji de yan se yi chuan zui jian dan jie shi shi shen me ？,hui se xing zhuang bi hei se xing zhuang ju you shang wei xing 。,hui se xing zhuang bi bai se xing zhuang ju you shang wei xing 。,hei bai yan se xing zhuang wei bu wan quan xian xing 。,hei bai yan se xing zhuang wei gong xian xing 。,C,high_school_biology,biology
guan yu ni yi ge gan xi bao zhong de  DNA， yi xia na zhong shuo fa shi zheng que de ？,ni de gan xi bao han you de  DNA  yu ni bai xi bao suo han  DNA  xiang tong 。,ni gan xi bao de da bu fen  DNA  jiang bei zhuan lu ， dan bu hui bei fan yi 。,ni gan xi bao de da bu fen  DNA  jiang zai xi bao he zhong bei zhuan lu ， bing zai xi bao zhi zhong bei fan yi 。,ni gan xi bao zhong de  DNA  han you tang yuan chu cun te you ji yin ， er qi ta xi bao bu han zhe xie ji yin 。,A,high_school_biology,biology
ren ti nei tong guo fen mi he zhong wu zhi lai wei chi zu gou de xue qing gai shui ping,jia zhuang xian su,yi gao xue tang su,sheng zhang ji su,jia zhuang pang xian ji su,D,college_biology,biology
yan zhe ge jia sheng zhang de zhi wu biao xian chu,xiang chu xing,xiang guang xing,xiang zhong li xing,fu xiang zhong li xing,A,college_biology,biology
ni tai shi yi zhong tong guo zi ran xuan ze jin hua de ce lve ， zhi zai ti gao sheng wu dui huan jing de shi ying xing 。 xia lie na xiang dai biao bei shi ni tai de yi zhong xing shi ？,yi zhong dui chan chu you du de qian zu chong zai chan chu shou ci chang shi shi yong hou hui bei chan chu yong jiu hui bi 。,yi zhi fei e zai qi wei duan zhan shi jia yan yi mi huo bu shi zhe 。,fei e cheng xian chu yu zhe feng ji hu xiang tong de yan se 。,yi zhi zai di mian zhu chao de hai ou chu niao xian shi chu yu zhou wei huan jing ji hu wu fa qu fen de se cai tu an 。,C,college_biology,biology
wei guan shi you wei guan dan bai ya ji zu zhuang xing cheng de dan bai si 。 hua xue xing qiu shui xian jian tong guo yu wei guan dan bai ya ji jie he ， zu zhi wei guan zu zhuang 。 shi yong qiu shui xian jian dui yi xia na zhong xi bao guo cheng sun hai zui da ？,you si fen lie qi jian de ran se ti pai lie he fen li,dan bai zhi he cheng qi jian de he tang ti he  mRNA  xie tiao,wu zhi kua zhi mo de yun dong,hua xue shen tou qi jian zhi zi zai ye lv ti lei nang ti nei de ji lei,A,high_school_biology,biology
wei shen me lu di sheng tai xi tong de jing chu ji sheng chan li qing xiang yu xiang re dai di qu zeng jia ， yi xia na xiang shi zui hao de jie shi ？,re dai di qu jiao gao de wu zhong duo yang xing qing xiang yu cu jin zhi wu sheng zhang 。,zai re dai di qu ， zhi wu sheng zhang de dai xie cheng ben jiao di 。,re dai di qu chong zu de shui fen gong ying he wen nuan de qi wen cu jin le guang he zuo yong 。,re dai di qu you geng duo de bu shi zhe ， zhe shi shi cao dong wu de shu liang jiang dao le zui di 。,C,college_biology,biology
jin qiang yu 、 sha yu he hai tun dou you lei si de liu xian xing wai guan ， zhe yi qing kuang de zui jia yuan yin shi shen me ？,ta men you zui jin gong tong zu xian 。,ta men wei chi le tong yi zu tu bian 。,ta men huo de le yi zhong liu xian xing ti xing ， yi zai qi te ding huan jing zhong sheng cun 。,liu xian xing shen ti zai qi huan jing zhong you xuan ze xing you shi 。,D,high_school_biology,biology
zhong qun “ gu ding ” ji yin zuo bi li yue gao ， zhong qun xia shu qing kuang yue di,he gan suan bian yi 。,yi chuan duo bei ti 。,ping jun za he xing 。,jin  A  he  C,D,high_school_biology,biology
zai wan dou zhong ， gao da zhi zhu （D） de deng wei ji yin dui ai xiao zhi zhu （D） de deng wei ji yin wan quan xian xing ， zi hua se （W） de deng wei ji yin dui bai hua se （W） de deng wei ji yin wan quan xian xing 。 zai yi ge ji yin xing wei  DDWw  de gao da zi hua zhi zhu yu yi ge ai xiao bai hua zhi zhu de za jiao zhong ， yu qi hou dai de biao xian xing bi li shi shen me ？,quan bu wei gao da zi hua,1  gao da zi hua ：1  ai xiao zi hua,1  gao da zi hua ：1  gao da bai hua ：1  ai xiao zi hua ：1  ai xiao bai hua,1  gao da zi hua ：1  gao da bai hua,D,college_biology,biology
yi wei ke xue jia zai liang zhi tun shu zhi jian jiao cha pei zhong ， zhe liang zhi tun shu dou you hei se pi mao 。 hei se pi mao shi xian xing ， bai se pi mao wei yin xing 。 si fen zhi san de hou dai you hei se pi mao ， si fen zhi yi you bai se pi mao 。 fu mu de ji yin xing zui you ke neng shi,bb × bb,Bb × Bb,Bb × bb,BB × Bb,B,high_school_biology,biology
liu gan bing du jin ru xi bao hou ， li ji kai shi yi xia na xiang huo dong ？,jiang bing du  DNA  zhi ru su zhu xi bao de ran se ti zhong,po huai su zhu xi bao de zhuan lu ji zhi,fu zhi qi yi chuan wu zhi bing he cheng bing du dan bai zhi,shi yong ni zhuan lu mei de bing du kao bei zhi zao bing du  DNA,C,college_biology,biology
hua shi zheng ju biao ming ， ma de ti ji sui di zhi shi jian tui yi zhu jian zeng da 。 yi xia na ge shu yu zui neng miao shu zhe yi dian ？,ren gong xuan ze,fang xiang xuan ze,wen ding xuan ze,fen lie xing xuan ze,B,high_school_biology,biology
zai nan mei zhou xi hai an de jia la pa ge si qun dao shang ， mou xie que qun yi bei zhang shi jian ge li 。 yu jiao da de da lu que zhong qun xiang bi ， zhe xie ge li zhong qun de bian yi geng da ， she ji zai geng guang wu zhong fan wei 。 zhe xie zhong duo que zhong zhong de bian yi shi you yu,qu tong jin hua,qu yi jin hua,fen lie xing xuan ze,wen ding xuan ze,B,high_school_biology,biology
yi ming sheng wu xue jia dui yi qun song shu yan jiu le  15  nian 。 qi jian ， zhong qun song shu cong wei shao yu  30  zhi ， ye cong wei chao guo  45  zhi 。 ta de shu ju xian shi ， you yu shi wu he bu shi jing zheng ， chao guo yi ban de yi chu sheng song shu mei you cun huo zhi fan zhi hou dai shi qi 。 dan dai you  90%  yi chu sheng de song shu cun huo zhi fan zhi hou dai shi qi ， gai zhong qun zeng jia dao  80  zhi 。 yi xia na xiang guan yu gai zhong qun de tui lun ke neng shi zheng que de ？,ke huo de shi wu liang ke neng zeng jia 。,bu shi zhe shu liang ke neng jian shao 。,sui hou ji dai de song shu ying gai bi qian ji dai de yi chuan bian yi geng gao ， yin wei guo qu wei cun huo de song shu xian zai ke cun huo 。,A、B  he  C  jun zheng que,D,high_school_biology,biology
yi xia na xiang shi guang he zuo yong guo cheng zhong chan sheng yang qi de lai yuan ？,H2O,H2O2,CO2,CO,A,high_school_biology,biology
zai yi chun tuo qing mei de cun zai xia ， yi quan huan yuan wei yi chun de su lv sui yi quan nong du de zeng jia er zeng jia 。 zui zhong ， fan ying su lv da dao zui da zhi ， ci hou yi quan nong du de jin yi bu zeng jia jiang bu zai chan sheng ren he ying xiang 。 zai zui da fan ying su lv xia ， yi xia na xiang shi zheng que de ？,ji hu suo you de mei fen zi dou zai yu yi quan fen zi xiang hu zuo yong 。,fan ying de huo hua neng jiang di 。,fan ying de zi you neng bian hua jian shao 。,mei dui yi quan bu zai ju you te yi xing 。,A,college_biology,biology
DNA  de jian ji zu cheng zai wu zhong zhi jian cun zai cha yi 。 nin yu ji  DNA  zhong de yi xia na zhong de bi zhi bao chi heng ding ？,bao mi ding : xian piao ling,mi ding : piao ling,xian piao ling : niao piao ling,niao piao ling : tuo yang he tang,B,high_school_biology,biology
zai xi bao fen lie guo cheng zhong chong dang you si fen lie fang chui ti fu zhuo dian de ran se ti bu fen shi,se su ti,ran se li,zhe si dian,zhong xin li,C,college_biology,biology
yi xia na xie te zheng ke qu fen yuan he xi bao he dong wu xi bao ？,he tang ti,xi bao mo,ye lv ti,xi bao bi,D,high_school_biology,biology
yi xia na yi zhong bu shi zhong jian xiang hu zuo yong de xing shi ？,pian li gong sheng,yan ti,hu li gong sheng,ji sheng,B,high_school_biology,biology
dong wu xian shi de yi zhong cheng wei gu ding dong zuo mo shi de xing wei fan ying,fa sheng zai dong wu zai qi yi sheng zhong de shi dang shi jian di er ci bao lu yu zheng que de ci ji shi,fa sheng zai mei you gan jue fan kui de qing kuang xia,shi yi zhong yun dong fan ying ， yi dan shi fang ke neng hui zi fa zhong zhi,you dong wu huan jing zhong de duo ge gan jue xin hao chu fa,B,college_biology,biology
ru guo yi zhong mei de huo xing zai guang fan de  pH  fan wei nei bao chi heng ding ， ze hen ke neng shi,zhi you mei shang de dian li ji tuan can yu fan ying,zhi you di wu shang de dian li ji tuan can yu fan ying,mei he di wu shang de dian li ji tuan dou can yu fan ying,mei huo di wu shang mei you dian li ji tuan can yu fan ying,D,college_biology,biology
jiang yi kuai ma ling shu fang ru zhuang you chun shui de shao bei zhong 。 yi xia na xiang shi ma ling shu jin shui de chu shi tiao jian ？,chun shui de shui shi wei fu 。,chun shui de shui shi wei zheng 。,ma ling shu de shui shi wei zheng 。,ma ling shu de shui shi wei fu 。,D,high_school_biology,biology
mou xie qin yuan zhi wu zhi jian de za jiao zhong shi bu yu de ， yin wei qin ben zhi wu de ran se ti shu mu bu tong 。 you shi ， zhe zhong za jiao zhi wu de ran se ti shu mu hui zi fa jia bei 。 yi xia na xiang zui hao di miao shu le na xie ran se ti shu mu jia bei de zhi wu de hou dai ？,ran se ti shu mu jia bei de zhi wu zai yi chuan shang shi you que xian de ， bing qie mei you hou dai 。,hou dai hui yin wei zeng qiang de ji yin shen ru neng li er ju you xuan ze you shi 。,hou dai jiang neng gou cheng gong fan zhi ， yin wei ta men ke yi yu qin ben wu zhong jin xing hui jiao 。,hou dai hui hui fu you xing sheng zhi de neng li ， yin wei ran se ti ke yi zheng chang pei dui 。,D,college_biology,biology
ni zhuan lu bing du jiang qi  DNA  cha ru xi jun ji yin zhong jian shi ， gai bian le yi ge jian ji dui de zheng chang yue du kuang 。 zhe lei tu bian cheng wei,chong fu,yi wei,dao wei,yi ma tu bian,D,high_school_biology,biology
ren lei ji yin zu zhong bian ma dan bai zhi di bi li da yue shi duo shao ？,2%,25%,50%,90%,A,college_biology,biology
jia she cheng wei  pike-cichlids  de yu shi shi zao yu de shi jue bu shi zhe （ ji jing shi jue ding wei lie wu ）。 ru guo shi zao yu zhong qun cheng shou le lai zi  pike-cichlids  de bu shi ya li ， na me yi xia na xiang zui bu ke neng zai duo dai shi zao yu zhong qun zhong guan cha dao ？,dan se shi zao yu xuan ze,ye jian shi zao yu xuan ze （ jin zai ye jian huo dong ）,ti xing jiao da ci xing shi zao yu xuan ze ， chan xia geng duo qie geng da de you zai,zai zheng ti ti xing jiao xiao shi da dao xing cheng shu de shi zao yu xuan ze,C,high_school_biology,biology
yi xia you guan yuan sheng sheng wu jie de sheng wu de shuo fa zhong ， na xiang shi zheng que de ？,ta men shi zhen he sheng wu 。,ta men bao kuo lan zao 。,ta men shi yi yang sheng wu 。,ta men de xi bao bi you tai ju tang zu cheng 。,A,college_biology,biology
ju you ε zhong lian bing wei yu fei da xi bao he shi jian xing bai xi bao de zhi mo shang de mian yi qiu dan bai shu yu na lei kang ti,IgE,IgA,IgD,IgM,A,college_biology,biology
suo you bing du zhi shao han you yi xia na liang zhong zhu yao cheng fen ：,DNA  he dan bai zhi,he suan he yi ke,DNA  he xi bao mo,RNA  he xi bao bi,B,high_school_biology,biology
ren lei shou bi 、 bian fu chi bang he hai tun qi zhe xie bu tong de jie gou bao han xu duo xiang tong de gu ge ， zhe xie gu ge you fei chang xiang si de pei tai zu zhi fa yu er lai 。 sheng wu xue jia ru he jie du zhe xie xiang si xing ？,tong guo shi bie gu ge shi tong yuan de,tong guo qu tong jin hua de yuan li,tong guo ti chu ren lei 、 bian fu he hai tun ju you gong tong zu xian,jin  A  he  C,D,high_school_biology,biology
yi ming yan jiu ren yuan zheng zai li yong yi zhi ju xing wu zei de shen jing yuan jin xing shen jing zhuan di shi yan 。 shi yan kai shi shi ， zhou tu chu yu jing xi zhuang tai ， zai  37℃  xia ce de yu zhi  -70 mV。 zhou tu jie shou yi zhong ci ji hou chu fa zhou tu de yi zhong dong zuo dian wei 。 sui hou de ci ji geng qiang 。 yi xia na zhong shuo fa jie shi le zhou tu jing guo ji ci qiang ci ji shi hui fa sheng shen me ？,zhou tu chao ji hua zhi  -90 mV。,zhou tu chao ji hua zhi  -50 mV。,dong zuo dian wei qiang du bian da 。,dong zuo dian wei pin lv zeng jia 。,D,high_school_biology,biology
fu wu ju you wu ge bu tong de te zheng 。 ta men shi ：,wu xing xing 、 jia zhi 、 ke bian xing 、 bu ke fen ge xing he que fa suo you quan 。,wu xing xing 、 jia zhi 、 ke bian xing 、 bu ke fen ge xing he ying li neng li 。,wu xing xing 、 yi shi xing 、 ke bian xing 、 bu ke fen ge xing he que fa suo you quan 。,wu xing xing 、 jia zhi 、 ke bian xing 、 bu ke fen ge xing he guan xi 。,C,marketing,business
gen ju wu de  (1991)  de guan dian ， qi ye she hui ze ren de san ge jie guo shi shen me ？,she hui zheng ce ， she hui ji hua he she hui ying xiang,she hui ping jia ， she hui ji hua he she hui ying xiang,she hui zheng ce ， she hui zheng ming he she hui ying xiang,she hui zheng ce ， she hui ji hua he she hui fen xi,A,business_ethics,business
wei ta ren mu di shou ji de er shou shu ju bei cheng wei ____________：,yi shou yan jiu 。,miao shu xing yan jiu 。,yin guo yan jiu 。,er shou yan jiu 。,D,marketing,business
zai pin pai ding wei guo cheng zhong shi yong _______________ lai shuo ming suo xuan pin pai de bu tong shu xing 。,chan pin te xing 。,SIC  dai ma 。,gan zhi di tu 。,zu zhi te zheng 。,C,marketing,business
dang qi ye / chan pin jin ru shuai tui qi shi ， zhe xie mu biao tong chang yong yu cheng shu shi chang 。 mu biao shi zui da hua duan qi li run he ci ji zheng xian jin liu 。,bo li mu biao 。,chi you mu biao 。,zeng zhang mu biao 。,shou ji mu biao 。,D,marketing,business
wei le tu chu cai gou xing wei fang fa de bian hua ，Svahn  he  Westerlund (2009)  que ding le zu zhi shi yong de liu zhong zhu yao cai gou ce lve 。__________ ce lve zhi de shi cai gou ren yuan de xiao lv qu xiang ， qi zhong zhu yao gou mai mu biao shi xun qiu chan pin de zui di jia ge 。 wei le shi xian zhe yi mu biao ， cai gou ren yuan ji ji tui dong ji ge qian zai gong ying shang zhi jian de jing zheng 。,“ yi jia zhe ” cai gou 。,“ shi ying zhe ” cai gou 。,“ jia ge zui di zhe ” cai gou 。,“ ji hua zhe ” cai gou 。,C,marketing,business
yi zhong tong guo dian zi you jian jin xing ying xiao de fang fa ， qi zhong xin xi de jie shou zhe yi tong yi jie shou gai dian zi you jian ， zhe zhong fang fa bei cheng wei ：,sou suo ying xiao 。,hu lian wang guang gao 。,ji yu xu ke de dian zi you jian ying xiao 。,she jiao wang luo ying xiao 。,C,marketing,business
_______ fan zhi qi ye shi yong de fu mian guang gao 、 qiang ke hu huo wa zou ke hu yi ji lve duo xing ding jia deng suo you ji liang 。,he li jing zheng xing wei,qi zha xing wei,jing zheng ba xi,bei bi shou duan,D,business_ethics,business
fen xiao wang luo zhong shun xu cheng yuan （ ru sheng chan shang 、 fen xiao shang he ling shou shang ） zhi jian she ji te ding fan wei huo jia ge shang zhang deng wen ti de chong tu bei cheng wei ：,qu dao chong tu 。,shui ping chong tu 。,chui zhi chong tu 。,gong ying lian chong tu 。,C,marketing,business
zhi zai xiang qu dao cheng yuan （ bao kuo zui zhong yong hu ） ti gong xin xi de ji yu hu lian wang de zu zhi bei cheng wei ：,xin xi zhong jie 。,ling shou shang 。,bai huo shang dian 。,pi fa shang 。,A,marketing,business
zai jin xing guo ji shi chang diao cha shi ， dui deng you san zhong lei xing 。 xia lie na yi xiang bu shi dui deng ？,gai nian shang dui deng 。,shi chang dui deng 。,gong neng dui deng 。,fan yi dui deng 。,B,marketing,business
yi si lan jin rong yu chuan tong jin rong zhi jian de yi xie guan jian qu bie bao kuo ： jin zhi shou qu he zhi fu _______， jin zhi jin xing ______ he ______ jiao yi ， jin zhi bu dao de tou zi ， yi ji yao qiu suo you jin rong chan pin dou bi xu you __________ zhi chi 。,li xi ， te ding de ， tou ji xing de ， wu xing zi chan,li xi ， bu que ding de ， que ding de ， wu xing zi chan,li xi ， bu que ding de ， tou ji xing de ， you xing zi chan,li xi ， te ding de ， que ding de ， you xing zi chan,C,business_ethics,business
yi xia na ge guo cheng bu shi jie shi xiao fei zhe ru he si kao hu le jie chan pin he pin pai de ji ben guo cheng ？,ren zhi 。,gan zhi 。,xue xi 。,ge xing 。,D,marketing,business
yi zhong you ren gong bian ji wei hu bing an lei bie he zi lei bie lie chu wang zhan de xin xi shu ju ku bei cheng wei ：,sou suo mu lu 。,zi dong yu yin ying da  (AVR)。,ying yong cheng xu 。,SEO。,A,marketing,business
qi zhong na xiang bu shu yu  March（1988  nian ） suo que ding de zai gao du mo hu huan jing zhong jin xing jue ce de guan jian liu ？,qi wang,xuan ze ji hui,wen ti,jie jue fang an,A,management,business
xu duo ren ren wei she hui zhong pu bian cun zai ________ tui li ， te bie shi zai qi ye zhong tong chang yi ___________ de xing shi chu xian 。,jie guo zhu yi ， cheng ben xiao yi fen xi,he li hua ， nian du shen ji,jie guo zhu yi ， nian du shen ji,he li hua ， cheng ben xiao yi fen xi,A,business_ethics,business
wei le shi jiao huan fa sheng ：,bi xu she ji dao yi ge fu za de she hui xi tong 。,ye bi xu fa sheng you zu zhi de ying xiao huo dong 。,yi ge yi li run wei dao xiang de zu zhi bi xu can yu qi zhong 。,mei yi fang dou bi xu yong you dui ling yi fang you jia zhi de dong xi 。,D,marketing,business
guang gao shi yi zhong shen me xing shi ？,ju jiao zhan lve,cha yi hua,cheng ben ling xian,zeng zhang,B,management,business
_______ jiang dao de zhi yu li xing fan wei zhi wai ， shi zai qing gan shang dui ta ren de “ dao de chong dong  ”。,mei de lun li,lun li li ji zhu yi,hou xian dai lun li xue,ze ren lun li,C,business_ethics,business
yi ge guo jia de jing zheng zai duo da cheng du shang shou dao qi ta guo jia de jing zheng de ying xiang ， yong shen me shu yu lai xing rong ？,guo ji mao yi,quan qiu jing ji,quan qiu jing zheng,quan qiu hua,D,management,business
_______  gong zuo shi jian shi zhi she ji shi jian 、 kong jian he ren wu xiang guan liu dong xing de gong zuo mo shi 。,dong tai,bu wen ding de,tan xing,xin shi de,C,business_ethics,business
suo shuo de kao lv ta ren guan dian 、 yi jian he xiang fa de ling dao feng ge shi shen me ？,zi you fang ren,yi ren wei ben,min zhu xing,zhuan zhi xing,C,management,business
