Question_ZH-PY,A_ZH-PY,B_ZH-PY,C_ZH-PY,D_ZH-PY,Answer_ZH-PY,Subject_ZH-PY,Subcategory_ZH-PY
wu nian qian ， yi tai yun suan su du zhi you dang qian dian nao yi ban de dian nao yao hua liang bei de qian 。 dang qian dian nao de su du yu jia ge zhi bi shi jiu dian nao su du yu jia ge zhi bi de bai fen zhi ji ？,20,400,32,\frac{2}{5},B,high_school_mathematics,math
Lucci  xian sheng gui na zheng li le  5  dai bi 。 ta zai mei ge dai zi li fang le  19  zhi hei bi he  12  zhi hong bi 。 na ge biao da shi biao shi le  Lucci  xian sheng fang ru dai zi zhong de bi de zong shu ？,(5 × 19) + 12,5 × (19 + 12),5 + (19 × 12),(5 + 19) × 12,B,elementary_mathematics,math
xia lie na yi dian bu shi bu deng shi  y > 9x – 8  he  y < – x + 8  de jie ？,"(– 2, 15)","(–1, 5)","(0, 0)","(1, 5)",A,high_school_mathematics,math
yi ge chang di de xing zhuang shi ti xing 。 zhe ge ti xing de duan di shi  130  ma zhang ， zhang di shi  390  ma zhang 。 liang ge di zhi jian de ju li shi  75  ma 。 chang di de mian ji shi duo shao ？,"9,750  ma ^2","19,500  ma ^2","29,250  ma ^2","39,000  ma ^2",B,elementary_mathematics,math
zai yi suo yong you  1650  ming xue sheng de gao zhong li ， you  132  ren zai gu piao shi chang jin xing ge ren tou zi 。 wei le gu ji gai xue xiao xue sheng de gu piao tou zi zong e ， ti chu le liang ge ji hua 。 ji hua  I  jiang sui ji chou qu  30  ming xue sheng ， zhao dao ta men ping jun tou zi de zhi xin qu jian gu ji zhi ， ran hou jiang zhe ge qu jian de liang duan cheng yi  1650， de dao zong tou zi de qu jian gu ji zhi 。 ji hua  II  jiang cong  132  ming zai shi chang shang tou zi de xue sheng zhong sui ji chou qu  30  ming xue sheng ， zhao dao ta men ping jun tou zi de zhi xin qu jian gu ji zhi ， ran hou jiang gai qu jian de liang duan cheng yi  132， de dao zong tou zi de qu jian gu ji zhi 。 na yi ge shi yong yu gu ji zhe ge xue xiao de xue sheng de gu piao shi chang tou zi zong e de geng hao de ji hua ？,ji hua  I,ji hua  II,liang zhong ji hua dou shi yong sui ji yang ben ， yin ci hui chan sheng xiang tong de jie guo 。,liang xiang ji hua dou wu fa gei chu zhun que de gu ji 。,B,high_school_statistics,math
"si she wu ru dao zui jie jin de wan wei hou ，2010  nian ， lu yi si an na zhou de ren kou wei  4,530,000。 na ge shu zi ke neng shi lu yi si an na zhou  2010  nian de shi ji ren kou ？","4,500,321","4,524,491","4,533,372","4,535,343",C,elementary_mathematics,math
yi chang yin yue biao yan de shi jian biao bao kuo  3  zu ， mei zu  20  fen zhong ， hai bao kuo  1  zu  40  fen zhong 。 mei zu zhi jian you  10  fen zhong de xiu xi shi jian 。 yin yue biao yan de zong shi chang wei  3(20 + 10)+ 40  fen zhong 。 yin yue biao yan de zong shi chang shi duo shao ？,73  fen zhong,110  fen zhong,130  fen zhong,210  fen zhong,C,elementary_mathematics,math
qiu  4/7 + 2/7。,14-Jun,Aug-49,14/28,7-Jun,D,elementary_mathematics,math
yi ge you san ge shi shu zu cheng de shu lie gou cheng yi ge deng cha shu lie ， di yi xiang shi  9。 ruo di er xiang jia  2， di san xiang jia  20， de dao de san ge shu zi xing cheng yi ge ji he ji shu 。 ji he ji shu di san xiang de zui xiao ke neng zhi shi duo shao ？,2,1,9,16,B,high_school_mathematics,math
yi ge zheng ba bian xing you duo shao tiao dui jiao xian ？,8,16,17,20,D,high_school_mathematics,math
yi ge yi xue yan jiu tuan dui shi yong san zhong bu tong ji liang de shi yan xing kang ai yao wu dui huan zhe yang ben jin xing zhong liu jian shao shi yan 。 yi xia na xiang shi zheng que de ？,you san ge jie shi bian liang he yi ge xiang ying bian liang 。,you yi ge jie shi bian liang you san ge ceng ci de xiang ying 。,zhong liu jian shao shi wei yi de jie shi bian liang ， dan you san ge xiang ying bian liang dui ying yu bu tong de ji liang 。,yi ge jie shi bian liang you san ge ceng ci 。,D,high_school_statistics,math
zong gong  x  ying chi de wei lan xing cheng yi ge shui ping de chang fang xing yuan zi de san mian 。 yuan zi zui da ke neng mian ji shi duo shao （ yong  x  biao shi ）？,x^2/9,x^2/8,x^2/4,x^2,B,college_mathematics,math
gen ju ping shang de biao qian ， yi pian a si pi lin pian de zhong liang shi  300  hao ke 。 mei guo shi pin yao pin jian du guan li ju  (FDA)  de yi ming diao cha yuan dui  7  pian yao pian de jian dan sui ji yang ben jin xing cheng zhong ， de dao  299、300、305、302、299、301  he  303  de zhong liang ， bing dui zhi zao shang de sheng ming jin xing jia she jian yan 。 xia mian na ge xuan xiang gei chu le zhe ge jian yan de  P  zhi ？,P(t > 1.54)，df = 6,2P(t > 1.54)，df = 6,P(t > 1.54)，df = 7,2P(t > 1.54)，df = 7,B,high_school_statistics,math
Jess  zai shang yi chang lan qiu bi sai zhong de le  18  fen 。 ta tou jin de mei yi ge qiu de  2  fen 。 ta tou jin le ji ge qiu ？,20,16,9,8,C,elementary_mathematics,math
5  he  211  zhi jian you duo shao ge qi wan quan ping fang shu ？,2,25,6,75,C,high_school_mathematics,math
ji suan  22/2 + 9。,10,11,20,2,C,elementary_mathematics,math
Bob's Burger Barn  wai de biao zhi xing zhuang shi yi ge zheng ba bian xing 。 ci fu hao de nei jiao shi duo shao du ？,90,135,45,180,B,high_school_mathematics,math
jia she  n > 1， qi zheng chu shu de cheng ji shi  n^6  de zui xiao zheng zheng shu  n  shi duo shao ？,30,64,2048,60,D,high_school_mathematics,math
zai  -36、 -29、-22、…、41、48  zhong you ji ge shu zi ？,12,10,13,11,C,high_school_mathematics,math
kao lv yi tiao chang du wei  10  de duan 。 dian  A  he dian  B  shi sui ji xuan ze de dian ， ta men jiang duan fen cheng san tiao geng xiao de duan 。 zhe san tiao geng xiao de duan gou cheng san jiao xing bian de gai lv shi duo shao ？,0,10%,25%,50%,C,college_mathematics,math
she  a\star b = a^b-ab。 ruo  2\star x = 22， qiu  x。,5,22,11,6,A,high_school_mathematics,math
mou cheng shi de yue jiang yu liang jin si wei zheng tai fen bu ， jun zhi wei  6  ying cun ， biao zhun cha wei  1.6  ying cun 。 yi xia na yi xiang shi zhe ge cheng shi zhe ge yue de zui gao jiang yu liang （ yi ying cun wei dan wei ）， er zhe ge yue ke neng shi zhe ge cheng shi suo jian guo de  10%  zui gan han de yue fen zhi yi ？,8.05,7.6,3.95,3.37,C,high_school_statistics,math
zuo tian ，Micah  chi le ou shu ge cao mei 。 ta hai chi le ji shu ge ping guo 。 na yi zu ke yi dai biao  Micah  zuo tian chi de cao mei  S  he ping guo  A ？,SSSSS；AAA,SSSSS；AAAA,SSSSSSSS；AAAA,SSSSSSSS；A,D,elementary_mathematics,math
he  $1^2 + 2^2 + 3^2 + 4^2 + \cdots + n^2 = n(n+1)(2n+1) \div 6。 ze  21^2 + 22^2 + \cdots + 40^2  de zhi shi duo shao ？,41,22140,19270,2870,C,high_school_mathematics,math
yi jian da yi de biao jia shi  325  mei yuan 。 zai  11  yue ， da yi mai bu chu qu ， shang dian lao ban ba ta de jia ge jiang di le  20%。 dao  12  yue ， ta you jiang jia ge xia tiao le  10%。12  yue de sheng dan gou wu zhe yao hua duo shao mei yuan mai zhe jian da yi ？,227.50  mei yuan,234.00  mei yuan,286.00  mei yuan,290.00  mei yuan,B,high_school_mathematics,math
7%  deng yu duo shao ？,0.007,0.07,0.7,7,B,elementary_mathematics,math
dang yi ming huan zhe xiang yi sheng zhu su mou yi zu te ding zheng zhuang shi ， yi sheng you  15%  de ji lv jiang huan zhe zhen duan wei ji bing  A。 ru guo yi ge you zhe xie zheng zhuang de huan zhe bei zhen duan wei ji bing  A， ta huo ta you  70%  de ji lv bei zhen duan wei ji bing  B。 mei you bei zhen duan wei ji bing  A  de you zhe xie zheng zhuang de huan zhe you  10%  de ji lv bei zhen duan wei ji bing  B。 you zhe zu zheng zhuang de huan zhe bei zhen duan wei zhi shao you qi zhong yi zhong ji bing de gai lv shi duo shao ？,0.235,0.25,0.765,0.85,A,high_school_statistics,math
"ru guo  30,000  chu yi  10， ran hou zai chu yi  10， jie guo shi duo shao ？",3,30,300,"3,000",C,elementary_mathematics,math
"jia she zai zhou ji gong lu xi tong shang hang shi de ka che de zhong liang shi zheng tai fen bu de 。 ru guo  70%  de ka che zhong liang chao guo  12,000  bang ，80%  de ka che zhong liang chao guo  10,000  bang ， na me zai zhou ji gong lu shang xing shi de ka che zhong liang de ping jun zhi he biao zhun cha shi duo shao ？","μ = 14,900; σ = 6100","μ = 15,100; σ = 6200","μ = 15,300; σ = 6300","μ = 15,500; σ = 6400",C,high_school_statistics,math
Estrella  xiang cheng wei yi ming hu li ren yuan ， bing can jia le shai xuan kao shi 。 zai ti gong kao shi de ji nian ， kao shi fen shu da zhi cheng zheng tai fen bu 。 gai kao shi de ping jun zhi wei  80， biao zhun cha wei  9。 zhi you na xie zai ce shi zhong de fen qian  15%  de xue sheng cai hui bei yao qing hui qu can jia jin yi bu de ping gu 。Estrella  zai ce shi zhong huo de le  90  fen 。 ta zai ce shi zhong de bai fen wei pai ming shi duo shao ？ ta shi fou you zi ge can jia jin yi bu ping gu ？,13.35； ta mei you zi ge 。,54.38； ta mei you zi ge 。,86.65； ta you zi ge 。,84.38； ta mei you zi ge 。,C,high_school_statistics,math
wo zai di  0  nian （ fa xing nian ） yi  104.1  mei yuan de jia ge gou mai le yi zhong wu nian qi zhai quan 、 piao mian li lv  8%， mian zhi  100  mei yuan 。 ru guo wo xu yao zai di san nian mo mai chu zhe zhi zhai quan ， dang shi de shi chang jia ge wei  82  mei yuan ， wo zai zhe xiang tou zi shang de chi you qi hui bao shi duo shao ？（ jia she xi piao bu zai tou zi 。） ti shi ： lei ji suo you xi piao 。,24%,23%,-21%,2%,D,professional_accounting,other
yi xia na yi zhong cai liao de dian zu shou wen du bian hua de ying xiang zui xiao ？,tong,tan,zhe,gui,A,miscellaneous,other
《 yue guang zou ming qu 》 shi shui chuang zuo de ？,mo zha te,han de er,ba he,bei duo fen,D,miscellaneous,other
zai can yu bian zhi fei fa xing ren cai wu bao biao shi ， kuai ji shi fa xian guan li ceng jiang tu di an ping gu jia zhi lie shi ， bing qie ru guo zun xun gong ren kuai ji zhun ze （GAAP）， ze tu di zhang hu he gu dong quan yi dou jiang jian shao  100  wan mei yuan ， zhe shi yi ge zhong da de jin e 。 you yu guan li ceng bu hui xiu gai cai wu bao biao ， kuai ji shi jue ding xiu gai biao zhun bian zhi bao gao 。 zai zhe zhong qing kuang xia ， kuai ji shi ying ：,yin bu fu he  GAAP  er gen ju zhong yao xing fa biao fou ding yi jian huo bao liu yi jian 。,zai kuai ji shi bao gao zhong tian jia yi ge dan du de duan luo ， jiang cai wu bao biao de fen fa xian zhi wei “ jin yong yu nei bu shi yong 。”,zai kuai ji shi bao gao zhong tian jia yi ge dan du de duan luo ， pi lu bu fu he  GAAP  ji qi dui cai wu bao biao de ying xiang 。,zai kuai ji shi bao gao zhong tian jia yi ge dan du de duan luo ， jie shi an li shi cheng ben ji lu zi chan de ji ben mu di 。,C,professional_accounting,other
xia mian de she zhong na yi zhong shi you du de ？,shui mang,mang she,tong ban she,ju mang,C,miscellaneous,other
xia lie na yi xiang zui hao di miao shu le dui yi zhong ju you fei tan xing xu qiu de chan pin ti jia hou de qing kuang ？,xu qiu liang bu bian 。,xu qiu liang jiang zeng jia 。,zong shou ru jiang jian shao 。,zong shou ru jiang bu bian 。,A,miscellaneous,other
2009  nian ， ai sai e bi ya er tong （8 sui ） zai guo qu yi zhou nei bao gao shou dao jiao shi ti fa de bai fen bi da yue shi duo shao ？,18%,38%,58%,78%,B,global_facts,other
"zhi ye zhe shou pin dui guan li bu men de sheng ming fa biao yi jian ， gai sheng ming cheng chu shou mian ji wei  150,000  ping fang ying chi de cang ku 。 zhi ye zhe ying can kao xia lie na ge lai yuan huo qu zhuan ye zhi dao ？",shen ji zhun ze sheng ming,jian zheng ye wu biao zhun sheng ming,kuai ji yu shen cha fu wu biao zhun sheng ming,zi xun fu wu biao zhun sheng ming,B,professional_accounting,other
yi wei shang ye lao shi rang xue sheng men fen xi zhe yang yi ge chang jing ： tian ran qi hang ye de ji jia gong si sheng chan yi zhong tong zhi chan pin ， bing zhu dao le shi chang 。 zhe zhong qing kuang zhu yao hui chan sheng yi zhong ju you dai biao xing de _____ shi chang jie gou,gua tou long duan,chun cui long duan,long duan xing jing zheng,chun cui jing zheng,A,miscellaneous,other
yi xia mu biao ， na yi ge shi zui shi he de ji shu jiao yu ji hua ， qi mu biao shi shi xue sheng kai fa chuang zao xing de ji shu jie jue fang an ， yi jie jue dang qian he wei lai de she hui wen ti ？,she ji bing jian zao yi ge di shou ru duo hu zhu zhai dan yuan de san wei mo xing,miao shu ji ge yu zhu zhai jian zhu xiang guan de jian zhu zhi ye,dui ji shu xi tong de zu jian jin xing fen lei,que ding gong lu jian she zhong shi yong de zhu yao gong ju he she bei,A,miscellaneous,other
an pei shi ce liang shen me de dan wei ？,dian he,dian liu,dian chang qiang du,dian shi,B,miscellaneous,other
xia lie na ge jie ri mei you gu ding de ri qi ？,du li ri,yuan dan,gan en jie,sheng dan jie,C,miscellaneous,other
hu la quan shi na ge nian dai fa ming de ？,1890  nian dai,1920  nian dai,1950  nian dai,1970  nian dai,C,miscellaneous,other
zai shen cha le yi ge zu zhi de zhong duan yong hu ji suan （EUC） zheng ce hou ， nei bu shen ji yuan dui jing suan zhi neng jin xing le shen ji ， bing zhu yi dao que shao yi xie zui di kong zhi yao qiu 。 xia lie na xiang shi shi yong ke neng bu zheng que de zhong duan yong hu kai fa wen jian de feng xian ？,guan li ceng dui zhe xie wen jian de yi lai cheng du yu dui zhu ji xi tong sheng cheng de wen jian xiang tong 。,you yu  EUC  wen jian que fa ling huo xing ， guan li ceng huo de de jue ce xin xi you xian 。,guan li ceng wu fa xun su ying dui jing zheng ya li 。,guan li ceng chi xu chan sheng e wai cheng ben ， yin wei shi yong  EUC  wan cheng zhe xie ren wu xu yao geng duo shi jian 。,A,professional_accounting,other
he lan de guan fang yu yan shi shen me yu ？,dan mai,rui dian,de guo,he lan,D,miscellaneous,other
jie zhi  2015  nian ， nong ye zhan yin du  GDP  zong liang de bai fen bi yue wei duo shao ？,8%,16%,32%,64%,B,global_facts,other
rou dao yun dong qi yuan yu na ge ya zhou guo jia ？,ri ben,yue nan,lao wo,fei lv bin,A,miscellaneous,other
xia lie na xiang bei shi wei di fang zheng fu yi ban mu di wai bu cai wu bao gao zhong bi xu de bu chong xin xi de yi bu fen ？,ji jin cai wu bao biao 。,he bing fei zhu yao ji jin bao biao 。,cai wu bao biao fu zhu 。,guan li ceng chen shu yu fen xi 。,D,professional_accounting,other
lu de jiao hui yin shui er de ming ？,xiao ma ding · lu de · jin,ma ding · lu de,lu de · fan de lu si,lai ke si · lu suo,B,miscellaneous,other
jie zhi  2018  nian ， yue you duo da bi li de mei guo cheng nian ren ren wei ji suan ji cheng xu jiang shi zhong fan ying ren lei pian jian ？,43%,58%,73%,88%,B,global_facts,other
"yi ge nong min hua  40,000  mei yuan mai le yi liang xin tuo la ji ， yu ji shi yong  20  nian ， zhi hou tuo la ji de can zhi jiang wei  10,000  mei yuan 。 suo you quan di yi nian de zhi xian zhe jiu shi duo shao ？",1500,1667,2000,2250,A,miscellaneous,other
xia lie na ge shu yu shi zhi shi yong niu qu lai chuang zao wu ti yan shen dao kong jian de cuo jue ？,xuan tiao,li shi ping heng,yun tu fa,tou ying suo jian,D,miscellaneous,other
ru guo zheng quan  A  he zheng quan  B  de xiang guan xi shu shi  -0.20， qie ta men de biao zhun cha fen bie wei  8%  he  18%， er tou zi zu he zhong si fen zhi yi tou zi yu zheng quan  A， si fen zhi san tou zi yu zheng quan  B， na me tou zi zu he de biao zhun cha shi duo shao ？,8.70%,13.20%,54%,6.60%,B,professional_accounting,other
zai shen ji mou gong si jie zhi di  1  nian  12  yue  31  ri de cai wu bao biao shi ， shen ji yuan zhu yi dao gai gong si de xiao shou e zai di  1  nian  12  yue xian zhu zeng jia ， tong shi zai di  2  nian  1  yue xiang ying jian shao 。 zai ping gu cai wu bao gao qi zha huo zi chan qin zhan de feng xian shi ， shen ji yuan ying xiao shou shou ru qian zai qi zha zuo chu shen me chu bu zhi shi ？,you guang fan de ji xiang biao ming nuo yong zi chan 。,you ji xiang biao ming gai shi ti de zi chan bei dao 。,you nuo yong gong kuan de ji xiang 。,you guang fan de ji xiang biao ming cai wu bao gao zao jia 。,D,professional_accounting,other
《 lao you ji 》 dian shi ju zhong na ge jue se shi chu shi ？,qiao yi,mo ni ka,luo si,rui qiu,B,miscellaneous,other
pi ta bing shi yi zhong shen me ？,xin xian shui guo,ping mian bao,fa guo dan ta,dou ban jiang,B,miscellaneous,other
ke hu yao rang kuai ji yuan dui pu tong fa qi zha fu ze ， bi xu zheng ming xia lie na yi dui yao su ？,zhong da xu jia chen shu he he tong wei yue 。,mian yu gong tong guo shi he sun shi 。,ming zhi he he li yi lai 。,yi tu qi pian he li yi guan xi 。,C,professional_accounting,other
zai di er ci shi jie da zhan qi jian ， zhe xie guo jia zhong na yi ge bu shi zhou xin guo lian meng de cheng yuan ？,de guo,yi da li,xi ban ya,ri ben,C,miscellaneous,other
zai ping gu nei bu shen ji yuan de neng li shi ， wai bu shen ji yuan ying geng xin xia lie na ge yin su de xin xi ？,nei bu shen ji yuan zai zu zhi zhong de hui bao di wei 。,nei bu shen ji yuan de jiao yu shui ping he zhuan ye jing yan 。,zheng ce shi fou jin zhi nei bu shen ji yuan shen ji qin shu suo zai de ling yu 。,dong shi hui 、 shen ji wei yuan hui huo suo you zhe jing li shi fou jian du yu nei bu shen ji yuan xiang guan de gu yong jue ce 。,B,professional_accounting,other
xia lie na yi zhong zui you ke neng shi da lu yan shi quan ban kuai he hai yang yan shi quan ban kuai peng zhuang de jie guo ？,yan hai huo shan shan mai lian,ci ji fan zhuan,da yang zhong ji,zhuan huan duan ceng,A,miscellaneous,other
zai sa ha la yi nan fei zhou ， jie zhi  2020  nian ，,mei you yi ge guo jia neng gou zai guo qu ji nian zhong shi xian zeng zhang 。,gang guo min zhu gong he guo bi  1980  nian shi geng qiong 。,yi xie guo jia de zeng zhang lv xiang dui jiao gao 。,yi xie guo jia de zeng zhang lv xiang dui jiao gao ， dan gang guo min zhu gong he guo bi  1980  nian shi geng qiong 。,C,global_facts,other
Houser  gong si yu  Chitwood  guo min yin hang da cheng le yi xiang  50  wan mei yuan de xun huan xin dai xie yi 。 gai xie yi yao qiu yi shi yong zi jin de li lv wei  10%， bu chang yu e wei  15%， yi ji wei shi yong xin yong e du de cheng nuo fei  1%。 ru guo gai gong si jie kuan  20  wan mei yuan yi nian ， qie gai pei chang yu e zai qi ta qing kuang xia bu hui wei chi ， gai gong si de you xiao nian li xi cheng ben zui jie jin yu,11.5%。,15%。,26.5%。,13.53%。,D,professional_accounting,other
mei guo guo qi shang you duo shao ke xing xing ？,13,48,50,51,C,miscellaneous,other
xia mian na ge dan ci shi  perambulate（ xun hui ） de tong yi ci ？,wen,han,man bu,zhi yu,C,miscellaneous,other
yong shen me shu yu lai biao shi wu lun cai qu shen me xing dong dou wu fa gai bian de bu ke bi mian de guo qu cheng ben ？,zhu yao cheng ben,chen mo cheng ben,ji hui cheng ben,zeng liang cheng ben,B,professional_accounting,other
1946  nian zhi zao de di yi tai ji suan ji de shou zi mu suo xie shi shen me ？,ENIAC,CASD,CNAC,CSREN,A,miscellaneous,other
fa ting zhi you jian bao de mu di shi,ying xiang zui gao fa yuan an jian de jie guo,jie shi zui gao fa yuan pan jue de li you,xiang zui gao fa yuan shen qing ren shen bao hu ling,ming ling yi fang zun shou zui gao fa yuan de pan jue,A,miscellaneous,other
zai mei guo ， chun tian de di yi tian shi na yi tian ？,2  yue  21  ri,3  yue  21  ri,4  yue  21  ri,5  yue  21  ri,B,miscellaneous,other
Toft  gong si jie zhi  1  yue  1  ri you  120000  gu pu tong gu liu tong 。 zai  4  yue  1  ri fa xing le e wai de  40000  gu pu tong gu 。 quan nian liu tong de hai you  10000  gu bu ke zhuan huan you xian gu ， bing zai nian nei xuan bu mei gu pai fa gu xi  5  mei yuan 。 nian du jing shou ru wei  480000  mei yuan 。Toft  ying bao gao de nian du mei gu shou yi shi duo shao ？,2.69  mei yuan,2.87  mei yuan,3.00  mei yuan,3.2  mei yuan,B,professional_accounting,other
"Felton Farm Supplies, Inc.  yong you  8%  de zong zi chan hui bao lv ， zong zi chan wei  300,000  mei yuan ， jing li run lv wei  5%。 ta de xiao shou e shi duo shao ？","3,750,000.00  mei yuan","480,000  mei yuan","300,000  mei yuan","1,500,000  mei yuan",B,professional_accounting,other
xian nv zuo shi shen me ？,li yin he xi zui jin de da xing xi,yi zhong neng dao zhi si wang de xi jun,yi zu she dian wang yuan jing,yuan su zhou qi biao zhong de yi zhong yuan su,A,miscellaneous,other
xia lie na xiang gui ding le gong zi he jia ban fei de biao zhun ， ying xiang le da duo shu si ying he gong gong bu men de jiu ye ？,《 gu yuan tui xiu shou ru bao zhang fa an 》,《 mei guo fu su yu zai tou zi fa an 》,《 gong ping lao dong biao zhun fa an 》,《 lian bang gu yuan bu chang fa an 》,C,miscellaneous,other
ru guo  1  he zi deng yu mei miao  1  ge zhou qi ， na me  1  zhao he deng yu mei miao duo shao ge zhou qi ？,-328716,1000,1000000,1000000000.0,C,miscellaneous,other
shui shi xi la shen zhou si de mu qin ？,gai ya,fei bi,rui ya,he la,C,miscellaneous,other
"Plaid Pants, Inc.  de pu tong gu de bei ta xi shu wei  0.90， er  Acme Dynamite Company  de pu tong gu bei ta xi shu wei  1.80。 yu qi de shi chang hui bao lv wei  10%， wu feng xian li lv wei  6%。 gen ju zi ben zi chan ding jia mo xing （CAPM） bing li yong shang shu xin xi ，Plaid Pants  pu tong gu de bi yao hui bao lv ying wei ___， Acme  pu tong gu de bi yao hui bao lv ying wei ___。",3.6%；7.2%,9.6%；13.2%,9.0%；18.0%,14.0%；23.0%,B,professional_accounting,other
xia lie na xiang bu neng zai shui wu shang tan xiao ？,he bing fei yong 。,lin shi dong shi fei yong 。,gu piao fa xing fei yong 。,zu zhi hui yi fei yong 。,C,professional_accounting,other
"shi mi si de tiao zheng hou zong shou ru （AGI） wei  120,000  mei yuan ， bu kao lv  40,000  mei yuan de zu lin fang di chan huo dong kui sun 。 shi mi si ji ji can yu zu lin fang di chan huo dong 。 zai que ding ying shui shou ru shi ， shi mi si ke yi kou chu duo shao zu lin kui sun ？",0  mei yuan,"15,000  mei yuan","20,000  mei yuan","40,000  mei yuan",B,professional_accounting,other
shen ji yuan hui shi yong xia lie na zhong chou yang fang fa lai gu ji zong ti de shu zhi ce liang ， li ru ku cun de mei yuan jia zhi ？,bian liang chou yang 。,fa xian chou yang 。,shu xing chou yang 。,sui ji shu chou yang 。,A,professional_accounting,other
nai lao shi na yi dao cai de bi bei shi cai ？,shou si,zha shu tiao,xiao niu rou pa er ma nai lao,ji rou xian bing,C,miscellaneous,other
xia lie na xiang wen jian tong chang shi zai cai wu kuai ji zhun ze wei yuan hui （FASB） xiu ding 《FASB  kuai ji zhun ze hui bian 》 de zheng dang cheng xu huo dong zhong fa bu de ？,ni yi de li chang sheng ming 。,ni yi de kuai ji zhun ze geng xin 。,ni yi de kuai ji yan jiu gong bao 。,ni yi de zhi yuan kuai ji gong bao 。,B,professional_accounting,other
gen ju  2020  nian mei guo de pu tong dao de biao zhun ， zai zhe liang ge chang jing zhong ， na ge chang jing zhong de zhu jue （ ji shi yong “ wo / wo men / wo men de ” zhe xie ci de ren ） zuo le ming xian zai dao de shang cuo wu de shi ？  chang jing  1 |  wo ba xi fa shui ping zi zhuang man le ti xu gao ， ran hou ba ta fang hui lin yu jian 。 chang jing  2 |  wo he jiu hu che bao chi zhe ju li 。,cuo ， cuo,cuo ， mei you cuo,mei you cuo ， cuo,mei you cuo ， mei you cuo,B,moral_scenarios,philosophy
xia lie na xiang bu shi a kui na gei chu de yi ge zi ming ming ti de li zi ？,“ zheng ti da yu bu fen 。”,“ zhu a ， ni lian shang de guang zai wo men shen shang da le ji hao ”,“ xiang deng de shi wu he xiang tong de shi wu bi ci xiang deng ”,“ ren shi yi zhong li xing de cun zai 。”,B,moral_disputes,philosophy
de xiao wei ci ren wei shen me lei xing de jie guo zhu yi li lun ke neng hui zai mou xie ji duan de te shu qing kuang xia wei kong bu zhu yi bian hu ？,ji yu xing wei de dao yi lun,ji yu gui ze de xiang le zhu yi,gui ze gong li zhu yi,xing wei gong li zhu yi,D,moral_disputes,philosophy
gen ju  2020  nian mei guo de pu tong dao de biao zhun ， zai zhe liang ge chang jing zhong ， na ge chang jing zhong de zhu jue （ ji shi yong “ wo / wo men / wo men de ” zhe xie ci de ren ） zuo le ming xian zai dao de shang cuo wu de shi ？  chang jing  1 |  wo qu le ting shi jian bian ren shi ti 。 chang jing  2 |  wo zai wo qi zi de jie jie er bian shuo le xie lang man de tian yan mi yu 。,cuo ， cuo,cuo ， mei you cuo,mei you cuo ， cuo,mei you cuo ， mei you cuo,C,moral_scenarios,philosophy
xia pi luo ren wei ， dui xi du cheng yin de zui hao jie shi shi,ge ren de xin tai he she hui huan jing 。,xi du de yao li xue xiao ying （ ru tuo yin ）。,yi ge ren de ji yin te zheng ， ta jie shi le wei shen me you xie ren you “ shang yin de xing ge ”。,te ding de xin li zhang ai ， ru qiang po zheng 。,A,moral_disputes,philosophy
xia lie na yi xiang bu shi pan chu si xing de qian zai fu mian hou guo zhi yi ？,yu fang wei lai de mou sha,ju da de cai wu cheng ben,ci ji xiao ying,dui wu gu zhe de chu jue,A,moral_disputes,philosophy
gen ju  2020  nian mei guo de pu tong dao de biao zhun ， zai zhe liang ge chang jing zhong ， na ge chang jing zhong de zhu jue （ ji shi yong “ wo / wo men / wo men de ” zhe xie ci de ren ） zuo le ming xian zai dao de shang cuo wu de shi ？  chang jing  1 |  wo dai wo san sui de hai zi qu ju yuan kan 《 shui mei ren 》。 chang jing  2 |  wo zou guo yi ge chi tang ， kan dao yi ge ni shui de hai zi ， jiu zai na shi ， wo tiao jin le chi tang ， wo na ang gui de xie zi bei nong zang le 。,cuo ， cuo,cuo ， mei you cuo,mei you cuo ， cuo,mei you cuo ， mei you cuo,D,moral_scenarios,philosophy
gen ju nuo ke luo si de guan dian ， xia lie na ge lun dian dui ren he pai chu dong wu de wan zheng dao de di wei de ni yi biao zhun ti chu le ju da de tiao zhan ？,ben ti lun lun dian,yu zhou xue lun dian,lai zi bian yuan an li de lun dian,yi shang dou bu shi,C,moral_disputes,philosophy
