Question_ZH-PY,A_ZH-PY,B_ZH-PY,C_ZH-PY,D_ZH-PY,Answer_ZH-PY,Subject_ZH-PY,Subcategory_ZH-PY
"ben wen ti she ji yi xia xin xi 。
 yi xia shi  1889  nian ba li shi bo hui de jie shao 。
“ zai bo lan hui qi jian ， te bie shi zai  8  yue fen ， dang da hui he fa guo xie hui zhao kai hui yi shi ， zai ba li yan jiu ren lei zi ran li shi de ji hui zai ren lei xue shi shang shi wu yu lun bi de 。 zai ren he shi hou ， fa guo shou du dou wei ren lei xue jia ti gong le nan de de you shi 。 mu si ka he bu luo ka shi yan shi 、 bo di long zai si fa gong de ren ti ce liang xue cao zuo 、 ren lei xue hui de ke cheng 、 zhi wu yuan de shou cang 、 yi xue xue hui de yuan shi gong zuo she shi yi ji yi yuan dou gei bi jiao jie pou xue jia he sheng wu xue jia ti gong le da liang de jiu ye ji hui 。”
 ao di si ·T· mei sen ， mei guo min zu xue jia he guan zhang ，1889  nian 
 na wei ke xue xian qu de gong zuo dui ba li shi bo hui zhong miao shu de ke xue jia ying xiang zui da ？",ai yin si tan,pu lang ke,nuo bei er,da er wen,D,high_school_european_history,history
"ben wen ti she ji yi xia xin xi 。
“ zai guo jia mian lin yan zhong wen ti de shi hou ， ren min de liang zhi yao qiu jian li yi ge yuan yu min zu zheng yi gan de xin de zheng dang 。 wo men jin bu dang zhi li yu lv xing xian bei men fu yu wo men de zhi ze ， wei hu yi ge min you 、 min zhi 、 min xiang de zheng fu ， yin wei zheng shi zhe xie ren min dian ding le zheng fu de ji chu 。 wo men zan tong tuo ma si · jie fei xun he ya bo la han · lin ken de guan dian ， ji ren min shi ta men xian fa de zhu ren ， yao shi xian xian fa de mu di ， bing bao hu xian fa mian shou na xie qu jie xian fa yi tu de ren de qin hai ， zhe xie ren ke neng hui ba xian fa bian cheng bu gong zheng de gong ju 。 gen ju mei yi dai ren de xu yao ， ren min bi xu shi yong ta men de zhu quan quan li lai jian li he wei hu ping deng de ji hui he gong ye gong zheng ， zhe shi wo men zheng fu jian li de ji chu ， mei you ta ， ren he gong he guo dou wu fa cun zai 。
“ zhe ge guo jia shu yu ju zhu zai zhe li de ren min 。 ta de zi yuan 、 qi ye 、 ji gou he fa lv ying yi zui neng cu jin pu bian li yi de fang shi jia yi li yong 、 wei chi huo gai bian 。 shi shi hou ba gong gong fu li fang zai di yi wei le 。”
 jin bu dang dang gang ，1912  nian 
 jin bu pai xi ao duo · luo si fu zai la ding mei zhou de “ da bang ” zheng ce de zui jia te zheng jiu shi ta",fou ding men luo zhu yi,xiang xin ou zhou guo jia you quan bao hu ta men zai gai di qu ren he sheng yu zhi min di de jing ji li yi,dui xi ban qiu xin du li guo jia zhu quan de cheng ren,xiang xin mei guo you yi wu tong guo zai zheng ge xi ban qiu ban yan bao hu jue se lai bao hu an quan yu wen ding,D,high_school_us_history,history
zai da yue  700  nian qian cong jiu shi jie dao xin da lu de di san ci yi min lang chao zhong ， shi shen me ren de wen hua shi yong yin cang de chuan zhi ， cong a la si jia dao ge ling lan dao ， chuan yue bei ji chuan bo kai lai ？,gu ai si ji mo ren,duo sai te ren,tuo le ren,ke luo wei si ren,C,prehistory,history
"ben wen ti she ji yi xia xin xi 。
“ ji quan zhu yi zheng quan de zhong zi shi you ku nan he kui fa zi yang de 。 ta men zai pin qiong he chong tu de xie e tu rang zhong man yan he cheng zhang 。 dang yi ge min zu dui mei hao sheng huo de xi wang po mie shi ， zhe lei zheng quan jiu hui chong fen cheng zhang 。 wo men bi xu bao chi zhe zhong xi wang ……  shi tai de xun su fa zhan gei wo men dai lai le ju da de ze ren ……  wo xiang xin ， guo hui jiang zheng shi zhe xie ze ren 。”
—— ha li ·S· du lu men zong tong ，1947  nian 
 yi shang zhe duan hua shi du lu men zong tong xiang guo hui ti chu de lun dian de yi bu fen ， yi zhi chi",《 tui wu jun ren zai shi ying fa an 》(G.I. Bill)。,qing dan de fa zhan 。,《 mai ka lun guo nei an quan fa an 》。,yan chang dui xi la he tu er qi de yuan zhu 。,D,high_school_us_history,history
"gen ju da yue  180  wan nian qian dao da yue  400,000  nian qian de yuan shi ren lei hua shi de xing tai ， yan jiu ren yuan ren wei ：",zai zhe yi shi qi ， you liang zhong huo liang zhong yi shang xiang guan dan di li wei zhi bu tong de yuan shi ren ， ta men shi cong zao qi de fei zhou yuan shi ren jin hua er lai de,zhe yi shi qi de yuan shi ren lei ke yi fen wei bu tong de wu zhong ， fen bu zai fei zhou 、 ya zhou he ou zhou 。,suo you cong neng ren jin hua er lai de yuan shi ren lei dou shu yu yi ge dan yi de 、 di li shang guang fan fen bu dan xing tai shang duo yang de wu zhong ， ji zhi li ren 。,yi shang dou shi,D,prehistory,history
"ben wen ti she ji yi xia xin xi 。
 ta men wen wo men jiang ru he zhi li zhe xie xin ling di 。 wo hui da ： yin di zhi yi ， zheng fu guan li de fang fa jiang hui zeng jia 。 ru guo ying guo neng tong zhi wai guo ling tu ， na me mei guo ye neng 。 ru guo de guo neng zhi li wai guo ling tu ， na me mei guo ye neng 。 ru guo ta men ke yi jian du bei bao hu guo ， na me mei guo ye ke yi 。 wei shen me guan li xia wei yi zhou bi guan li xin mo xi ge zhou huo jia li fu ni ya zhou geng nan ？  ta men dou you ye man ren he wai lai ren kou ； zhe liang ge zhou zai shou wo men tong zhi shi ， dou bi jin tian de fei lv bin li zheng fu suo zai di geng yuan 。
 ni hui tong guo ni de tou piao shuo mei guo de zhi li neng li yi jing shuai tui 、 yi ge shi ji de zi zhi jing yan shi bai le ma ？  ni hui tong guo ni de tou piao que ren ni bu xiang xin mei guo quan li he shi ji yi shi ma ？  huo zhe ， ni hui shuo wo men de xue shi zheng fu de xue 、 wo men de tong zhi zhi xin shi zheng fu de tong zhi zhi xin 、 wo men de da nao he guan li tian cai shi zheng fu de da nao he guan li tian cai ma ？  ni hui bu hui ji de ， wo men suo zuo de bu guo shi wo men de xian bei suo zuo de —— wo men zhi bu guo shi xiang xi 、 xiang nan zha zi you de zhang peng —— wo men zhi bu guo shi rang xing tiao qi ji xu qian jin er yi ？
—— a er bo te · bei fu li qi ，《 xing tiao qi zai qian jin 》， yin di an na bo li si ，1898  nian  9  yue  16  ri 
 bei fu li qi de yan jiang shi dui yi xia na ge wen ti de hui ying ？",gou mai a la si jia,mo xi ge zhan zheng,mei xi zhan zheng,di yi ci shi jie da zhan,C,high_school_us_history,history
guan yu da jin ba bu wei zhong yang jian zhu qun de cheng qiang ， xia lie suo you shuo fa dou shi zheng que de ， chu le ：,ta men shi you  100  duo wan kuai hua gang yan zhuan jian cheng de 。,ta men zhan shi le fu za de zhuan shi jie gou 。,you xie di fang you  40  ying chi gao 。,jiang ta men lian jie zai yi qi de sha jiang shi you mo sui de hai yang bei ke zhi cheng de 。,D,prehistory,history
zhi li ren de te dian shi ：,you yi zhong fu za de shi qi ji shu ， he zuo shou lie ， yi ji dui huo de kong zhi 。,you yi zhong yuan shi de shi qi gong ju ji shu ， dui mu cai de fu za shi yong lai jian zao bi hu suo ， yi ji yi zhi zui zao de yuan yi 。,he zuo shou lie ， you kong zhi di shi yong huo ， yi ji bao han xu duo mu zang pin de jing xin mai zang 。,you yi zhong yuan shi de shi qi ji shu ， you bu yu he jian zao shi zhi jian zhu de di yi ge zheng ju 。,A,prehistory,history
"ben wen ti she ji yi xia xin xi 。
“ wei yi qiang da dao zu yi da po she hui xi su de li liang shi jing ji xu yao ……  jing ji shang de xu yao po shi nv xing zou chu jia men ， jin ru shang ye shi jie ， zhe che di cui hui le nv xing zhi ying gai zai zi ji jia li huo peng you jia li chi fan de jiu guan nian ， chuang zao le yi zhong quan xin de she hui xian xiang ， cheng qian shang wan nv xing zai gong gong chang he chi fan ， mei you nan xing pei tong ， bing shi can yin ye jin ru le yi ge quan xin jie duan 。”
——《 niu yue shi bao 》，1905  nian  10  yue  15  ri 
 yi shang wen zhang zhong miao shu de chang jing zui zhi jie di fan ying zai yi xia na yi xiang zhong ？",1964  nian 《 min quan fa an 》。,《 ping deng quan li xiu zheng an 》。,《 chun jing shi pin huo yao pin fa an 》。,《 zhou ji mao yi fa an 》。,B,high_school_us_history,history
"ben wen ti she ji yi xia xin xi 。
“ bo la tu qu dai xue yuan pai de ya li shi duo de de jin cheng you yu yu bai zhan ting xue shu de jie chu er jia su 。 zao zai ming yi shang tong yi liao dong xi fang jiao hui de fei lei la wei yuan hui （1438 nian ） shang ， jiu you yi chang zheng lun ， bai zhan ting ren ren wei bo la tu bi ya li shi duo de you yue 。 ke xi mo he luo lun zuo · de · mei di qi dou chen mi yu bo la tu ； ke xi mo chuang li le zhu yao zhi li yu yan jiu bo la tu de fo luo lun sa xue yuan ， luo lun zuo ji xu jing ying fo luo lun sa xue yuan …… ran er ， dang shi de ren wen zhu yi zhe mang yu huo qu gu dai zhi shi ， wu fa chuang zao ren he you jia zhi de dong xi 。”
 bo te lan · luo su ， ying guo zhe xue jia ，《 xi fang zhe xue shi 》，1946  nian 
 cong wen zhong ke yi tui duan ， fei lei la wei yuan hui",wei fo luo lun sa mei shu xue yuan dian ding le ji chu,yong jiu di tiao he le dong xi fang jiao hui zhi jian de fen qi,jia su le dui xi ou gu dian zhe xue de chong xin fa xian,yun xu bai zhan ting ren xue xi fo luo lun sa de xue shu,C,high_school_european_history,history
"ben wen ti she ji yi xia xin xi 。
 yi xiang dui yi min shi jia mou xie xian zhi bing gui ding jiang wei jin yi min qu zhu chu ying lian bang de fa an 。
…
3.  jin zhi ben jie yi xia ren he duan luo suo shu ren yuan （ xia cheng “ bei jin zhi yi min ”） yi min dao ying lian bang ， ji 
(a)  zai guan yuan yao qiu xia bu neng dang zhe guan yuan de mian tong guo guan yuan zhi shi de ou zhou yu yan mo xie bing qian shu yi duan zhang da  50  zi de wen zi de ren he ren ；
(b)  bu zhang huo ren he guan yuan ren wei dui gong zhong huo ren he gong gong huo ci shan zu zhi zao cheng fu dan de ren he ren ；
…
(g)  gen ju he tong huo xie yi zai lian bang jing nei cong shi ti li lao dong de ren he ren ： dan ben kuan bu shi yong yu yin ao da li ya suo xu de te shu ji neng er huo de bu zhang huo mian de gong ren ……
《1901  nian yi min xian zhi fa 》（ ao da li ya ）
 jian yu mei guo zheng fu ren wei ， zhong guo lao gong lai dao mei guo hui wei ji mei guo jing nei mou xie di fang de liang hao zhi xu ；
 yin ci ，
 you mei li jian he zhong guo guo hui can zhong liang yuan ban bu ， zi ben fa an tong guo hou jiu shi tian qi ， zan ting zhong guo lao gong lai mei ； zai gai zan ting qi jian ， ren he zhong guo lao gong lai mei huo zai jiu shi tian qi man hou liu zai mei guo jing nei jun shu fei fa 。
SEC. 2.  ming zhi gu fan ， cong ren he wai guo gang kou huo di fang jiang ren he zhong guo lao gong dai ru mei guo jing nei ， bing zai gai chuan shang deng lu huo yun xu qi deng lu de chuan zhu ， ying shi wei fan you qing zui ， yi jing ding zui ， ying jiu mei ming ru ci dai ru de zhong guo lao gong chu yi bu chao guo wu bai mei yuan de fa kuan ， bing ke chu yi bu chao guo yi nian de jian jin ……
《1882  nian pai hua fa an 》（ mei guo ）
 zhe xie duan luo zui neng bei kan zuo shi  19  shi ji na ge tu chu de she hui huo jing ji qu shi de li zi ？",fan you yi shi xing tai de xing qi,mao yi bao hu zhu yi,cong guo wai xi yin shu lian gong ren de yuan wang yue lai yue qiang lie,fan yi min qing xu jia ju,D,high_school_world_history,history
jia su quan qiu ren kou zeng zhang de liang shi sheng chan ge ming bei cheng wei ________； ta fa sheng zai _____ nian qian 。,"jiu shi qi shi dai wan qi guo du ； zai  35,000  nian qian","zhong shi qi shi dai ren kou zhuan xing ； cong  18,000  nian qian kai shi","xin shi qi shi dai ren kou zhuan xing ； cong  11,000  nian qian kai shi","xin shi qi shi dai ge ming ；5,000  nian hou",C,prehistory,history
"ben wen ti she ji yi xia xin xi 。
 yue du xia mian de wen dang 。
 lai yuan  1
 mian hua shi yi zhong jin kou shang pin ， ta you qi ta guo jia gong ying ， er qie zai ren he di fang dou neng yi ping deng de tiao jian huo de ， ru guo tong guo ji qi de shi yong ， mian hua de sheng chan qu de le ru ci jing ren de cheng gong ， na me ， yin wei yang mao shi wo men ben dao de chan pin ， shi suo you guo jia dou xu yao de shang pin ， ji hu shi ren lei de tong yong fu zhuang ， zui da xian du di pei yu yang mao de sheng chan ， nan dao bu ying gai you geng da de hao chu ma ？
 zai mao zhi pin de sheng chan zhong ， tu bu ji 、 fang sha ji he fei suo jian shao le jin san fen zhi yi de shou gong lao dong ， ta men mei yi zhong gang tui chu shi dou yin qi le lao dong zhe de jing jue ， dan ta men dou dui ti gao gong zi he cu jin mao yi zuo chu le gong xian ， yin ci ， ru guo xian zai you ren qi tu bo duo wo men shi yong ta men de quan li ， hao wu yi wen ， mei yi ge cong shi zhe xiang shi ye de ren du hui jie li han wei ta men 。
—— li zi bu shang de sheng ming ，1791  nian 
 lai yuan  2
 da ming ding ding de nong min xiao huo zi men lai le 
 ta men xi huan he zong se de hao mai jiu 
 da dao mei yi ge ao man de bao jun 
 na zhe fu tou 、 chang mao he qiang ！
 zhe qun xiao huo zi men 
 yong gan de xiao huo zi men 
 hui dong you li de wu qi 
 da po fan li 
 nong min xiao huo zi men chong wo lai le ！
 sui ran te shu qing kuang hai zai ji xu 
 shi bing men mei wan zai wo men zhou wei huan teng 
 xiao huo zi men reng yi ma dang xian 
 na zhe fu tou 、 chang mao he qiang ！
 zhe qun xiao huo zi men 
 yong gan de xiao huo zi men 
 hui dong you li de wu qi 
 da po fan li 
 nong min xiao huo zi men chong wo lai le ！
——《 lu de yun dong zhi ge 》，《 nong min zhi ge 》，c。1812  nian 
 yi xia na yi xiang zui hao di miao shu le  1850  nian qian zheng fu dui lai yuan  2  zhong suo jian de tou su de fan ying ？",1850  nian yi qian ， zheng fu ji hu mei you jie jue gong ye hua de wen ti 。,gai ge yun dong dao zhi le dui gong ren de gong zuo shi jian 、 nian ling he xing bie de gui ding 。,zai ying guo kai shi shi yong zi lai shui he xia shui dao 。,zheng fu jian li le yi ge quan guo xing de yi liao bao jian xi tong 。,B,high_school_european_history,history
kao gu xue jia ru he miao shu zai ge bei ke li shi zhen 、Watson Brake  he bo fu di jiao jian zao ji nian xing jian zhu de min zu ？,nong xue jia,feng fu de mi shi zhe,gu lao de guo jia,yuan shi wen ming,B,prehistory,history
yi jia dian ying yuan you yi ba zuo yi ta le ， zao cheng zuo zai gai zuo yi shang de gu ke shuai dao di shang ， bei bu shou shang 。 zai gai gu ke dui dian ying yuan ti chu de ren shen shang hai su song zhong ， gai gu ke hen ke neng,hui huo de pei chang ， yin wei dian ying yuan fu you bao zhang ying ye chang suo an quan yi bao hu gu ke de jue dui zhu yi yi wu 。,zhi you dang dian ying yuan shi xian jiu zhi dao zuo yi cun zai wei xian zhuang kuang shi ， hui huo de pei chang 。,bu hui huo de pei chang ， yin wei dian ying yuan mei you yi wu jian cha ying ye chang suo ， yi fa xian wei zhi de wei xian 。,bu hui huo de pei chang ， chu fei dian ying yuan mei you dui zuo yi jin xing he li jian cha ， yi bao hu gu ke an quan 。,D,professional_law,law
yi xia na yi ge yin su dui zi ran fa zai  20  shi ji de fu xing qi le zhong yao zuo yong ？,20  shi ji  30  nian dai de da xiao tiao 。,fa xi si zhu yi de xing qi 。,di er ci shi jie da zhan hou guo ji she hui dui ren quan de ren ke 。,bu er shi wei ke ge ming 。,C,jurisprudence,law
lian bang fa lv gui ding xiang ge zhou ti gong er tong fu li ji hua zi jin ， dan qian ti tiao jian shi ci lei ji hua ying gen ju lian bang biao zhun yu yi guan li 。 mei guo lian bang zheng fu zai lian bang fa ting shang qi su mou ge zhou yi huo de jin ling jiu ji ， cheng gai zhou de er tong fu li ji hua （ zhe xie ji hua bu fen di shou dao gen ju gai fa lv bo fu de lian bang zi jin de zhi chi ） wei neng zun xun lian bang biao zhun 。 gai zhou yi shen qing bo hui su song 。 fa ting shi fou you ke neng bo hui su song ？,fou ， yin wei guo hui ke yi dui lian bang zi jin de jie shou gui ding ren he tiao jian 。,fou ， yin wei 《 di shi yi xiu zheng an 》 bing wei jin zhi you mei guo lian bang zheng fu ti qi de su song 。,shi ， yin wei 《 di shi yi xiu zheng an 》 jin zhi zai lian bang fa ting shang dui zhou zheng fu ti qi su song 。,shi ， yin wei dui er tong fu li de bao hu you ge zhou bao liu 。,B,professional_law,law
shang jia chu shou shang pin de bu ke che xiao shu mian bao pan （ shi pan ）,ru guo shou pan ren ti gong yi fen bao han gai bao pan de ge shi he tong ， ze bi xu dan du qian shu 。,you xiao qi wei san ge yue 。,bu ke zhuan rang 。,ji shi ti gong le dui jia ， you xiao qi ye bu de chao guo san ge yue 。,A,professional_law,law
fang dong yong you yi zuo liang ceng lou de jian zhu wu 。 fang dong jiang jian zhu wu ji qi zhou wei de tu di zu gei yi ming zu hu ， zu qi cong  2006  nian  12  yue  1  ri kai shi ， dao  2008  nian  11  yue  30  ri jie shu 。 ta men de zu lin xie yi bao han yi xia tiao kuan ：“ zu hu tong yi mei yue de di yi tian zhi fu  500  mei yuan de zu jin ， bing zai zu yue qi man zhi qian bao chi suo zu jian zhu wu de liang hao wei xiu zhuang tai 。”2007  nian  4  yue  15  ri ， zu hu ju ban le nian du de “ bao shui pai dui ”， ta he ta de peng you men yi qi bu xing dao you ju you ji shui dan ， ran hou zai zu hu de gong yu li he jiu 、 chi fan qing zhu 。 zai he le ji bei jiu zhi hou ， zu hu de yi wei peng you dui zhi yi ta de bu fen kou chu xiang de yi wei pai dui can yu zhe tai du bian de man heng 。 peng you chao zhe na wei pai dui can yu zhe chong guo qu ， hou zhe shan kai hou peng you zhuang dao le qiang shang 。 zhuang ji dao zhi gong yu zhong yi mian qiang zao dao yan zhong sun huai 。 gai zhou shu yu pu tong fa si fa guan xia qu 。 ci wai ， kong zhi fa gui ding guo shi zao cheng sun hai de qi su shi xiao wei zi sun hai yuan yin fa sheng zhi shi qi ji suan de wu nian 。 zai jie shi zu hu zai wei xiu tiao kuan xiang xia de yi wu shi ， yi xia na yi xiang chen shu zui zhun que ？,gen ju wei xiu qi yue ， cheng zu ren dui zheng chang mo sun fu you ze ren 。,gen ju ci wei xiu qi yue ， cheng zu ren dui suo you que xian ， bao kuo qiang bi sun huai ， fu you ze ren 。,you yu fang dong dui zu lin wu ye fu you ji ji wei xiu ze ren ， cheng zu ren de wei xiu qi yue bei ren wei wei fan gong gong zheng ce er wu xiao 。,cheng zu ren fu you bao chi zu lin wu ye liang hao wei xiu de yi wu ， fang dong yin ci bu xu pi lu ren he qian zai que xian 。,B,professional_law,law
you yi wei xin ren jia ru le yi ge bu zhi ming di fang de xiao zhen ， bing zai na li zhao dao le yi fen dan ren shi zheng gong zuo ren yuan de gong zuo 。 shi zheng shou ce gui ding ， xin ren zai gong zuo de qian san nian yao xiang gai shi de yuan gong fu li ji jin jiao na geng duo de fei yong 。 xin ren ju jue zhi fu bi qi ta yuan gong geng gao de jiao kuan ， yu shi ta bei jie gu le 。 ta shi fou neng cheng gong di ti chu ping deng bao hu de lun ju lai zheng qu zi ji de gong zuo ？,fou ， ta bu shu yu ke yi lei bie de yi yuan ， yin wei zai jiu ye fa zhong bu ke neng cun zai yi ge ren shu yu “ du te lei bie ” de xian xiang 。,fou ， yao qiu jiao kuan bing fei bu he li ， yin ci wu fa zhi chi ping deng bao hu de lun dian 。,shi ， ta ke yi sheng cheng zi ji shu yu zao shou qi shi de du te lei bie 。,shi ， ta ke yi sheng cheng zi ji shi yi qun xin ren zhong de yi yuan ， zhe xie xin ren gang lai qie shou dao le yu qi ta ren bu tong de dai yu ， ji shi ta shi ta mu qian suo zhi de wei yi xin ren 。,A,professional_law,law
yi jing cha jie dao yi ge kai gong si de peng you de dian hua 。 peng you gao su ta you ge xing ge lu mang de qian yuan gong gei ta da sao rao dian hua ， hai wei xie ta 。 ta gei gai jing cha fa song chuan zhen ， yong yi duan hua gai kuo le zhe jian shi 。 gai jing cha shen wen le qian yuan gong ， hou zhe ma sheng bu duan ， jian jue fou ren zi ji da guo dian hua 。 gai jing cha yi xing shi sao rao he fei fa shi yong tong xin she bei wei you dai bu le ta ， bing shuo ：“ wo yao gei ni dian jiao xun 。” dan zhe qi xing shi an jian zai yu shen shi bei che xiao ， yin wei gai jing cha wu fa ti chu zheng ju zheng ming qian yuan gong gei gong si da guo dian hua 。 ran hou ， qian yuan gong yi e yi su song de qin quan xing wei wei you qi su gai jing cha he gong si lao ban 。 pao kai gai jing cha shi fou ke yi bei huo mian bu tan ， qian yuan gong neng fou ti chu zu yi zhi chi e yi su song an jian de shi shi ？,bu neng ， yin wei gai jing cha cong gong si lao ban na li de dao le zu gou de shi shi ， ke yi que ding ta dui qian yuan gong ti qi de xing shi zhi kong de yao su 。,neng ， you zu gou shi shi gong qian yuan gong que ding e yi su song qin quan xing wei de ji ben yao su 。,bu neng ， yin wei ji shi wu fa zheng ming ， gong si lao ban hai shi zhi dao shi qian yuan gong da di dian hua 。,neng ， gai jing cha bu zheng dang li an shi ， jiu gou cheng le lan yong fa lv cheng xu 。,B,professional_law,law
yi ming yuan gao qi su yi jia bao xian gong si ， yi zhui hui ren shou bao xian shou yi 。 zai shen pan zhong ， fa ting mian lin de wen ti shi bei bao xian ren de zheng que chu sheng ri qi 。 ru guo xia lie ge xiang bei cheng jiao yi zheng ming bei bao xian ren de zheng que chu sheng ri qi ， ze xia lie na yi xiang shi bu ke jie shou de ？,yi zhang ke you jia ting cheng yuan nian ling de quan jia fu zhao pian 。,yi ben zai feng ye shang xie you bei bao xian ren chu sheng ri qi de jia yong sheng jing 。,yi zhang bei bao xian ren chu sheng zheng ming de zhao pian 。,yi fen bei bao xian ren xiong di de xuan shi zheng ci ， zheng ming bei bao xian ren de chu sheng ri qi 。,D,professional_law,law
yi wei yi shuang shi yi dong gong yu lou de yong jiu suo you quan yong you zhe 。 zhe wei yi shuang qi cao le yi fen yi zhu ， jiang gong yu lou zeng yu sun nv ， bing jiang sheng yu cai chan zeng yu ta de peng you he zhu li 。 yi nian hou ， sun nv zai mei you liu xia yi zhu de qing kuang xia qu shi ， ta de er zi bian cheng le ta wei yi zai shi de fa ding ji cheng ren 。 gai si fa guan xia qu de xian xing fa gui ru xia ：“ ru guo zu fu mu huo zu fu mu de zhi xi hou yi de shou yi zeng ren zai yi zhu zhi xing shi si wang huo wei neng zai yi zhu ren qu shi hou cun huo ， ze si zhe de hou dai ying ji cheng bei ji cheng ren zai yi zhu zhong de fen e 。” zhe wei yi shuang sui hou qu shi ， ta de yi zhu huo de le yi zhu ren zheng 。 peng you 、 zhu shou he er zi zhi jian jiu gong yu lou de suo you quan fa sheng le zheng yi 。 er zi shi fou you quan huo de gong yu lou de ren he fen e huo quan yi ？,shi ， yin wei gen ju fan yi zeng shi xiao fa gui ， sun nv de quan yi jiang zhuan yi gei ta de er zi 。,shi ， yin wei yu gai kuo zeng yu shi xiao you guan de gui ze bu shi yong yu te ding de yi zeng 。,shi ， yin wei wu yi zhu ji cheng bu shi yong yu jiang suo you quan zhuan gei te ding de shou yi zeng ren 。,fou ， yin wei sun nv xian yu zhe wei yi shuang qu shi ， gen ju yi zhu zhong de sheng yu cai chan tiao kuan ， gong yu lou de suo you quan zhuan gei le peng you he zhu li 。,A,professional_law,law
yi ge lian bang da pei shen tuan zhao kai hui yi ， diao cha wai guo zheng fu she xian hui lu zong tong te bie gu wen yi an 。 da pei shen tuan zheng zai diao cha wai guo zheng fu wei huo de bei mei guo guo wu yuan jin yun de yun shu ji er zuo chu de nu li 。 si fa bu shi tu cha ming wai guo zheng fu shi fou xiang te bie gu wen he mei guo zheng fu qi ta cheng yuan xing hui ， yi que bao yun shu ji de jiao fu 。 te bie gu wen zai da pei shen tuan mian qian zuo zheng shuo ， ta he zong tong dou yu wai guo zheng fu zhu mei guo da shi ju xing guo ji ci hui yi 。 ta shuo ， zai zhe xie hui yi shang ， ta men tao lun le ben di qu de yi ban wen ti 。 bu guo ， ta fou ren can yu le wai guo zheng fu wei que bao jiao fu yun shu ji suo zuo de nu li 。 te bie gu wen zuo zheng liang zhou hou ， da pei shen tuan ti chu qi su ， zhi kong ta he ling wai liang ming zong tong mu liao mi mou xing hui he mi mou qi pian mei guo zheng fu 。 si fa bu sui hou ren ming le yi ming te bie jian cha guan ， wei zheng fu li an zuo zhun bei 。 gen ju te bie jian cha guan de dong yi ， si fa bu fa chu le chuan piao ， yao qiu zong tong chu shi ta yu wai guo zheng fu te bie gu wen he da shi de hui wu ji lu 。 te bie jian cha guan tong guo zhi qian chuan huan de an pai ji lu ， que ding le zhe xie hui mian di que qie ri qi 。 zong tong gong bu le ji fen jing guo bian ji de tan hua ji lu 。 tong yi tian ， zong tong de lv shi ti chu dong yi ， yao qiu che xiao chuan piao ， sheng cheng yong you jue dui de xing zheng te quan 。 guan yu zong tong sheng cheng de xing zheng te quan ， yi xia na xiang biao shu zui wei zhun que ？,gen ju fen quan yuan ze ， lian bang si fa ji gou wu quan shen cha zong tong guan yu xing zheng te quan de zhu zhang 。,chu yu dui gao ceng tong xin bao mi de xu yao ， zong tong zai ren he qing kuang xia dou xiang you jue dui wu tiao jian de si fa cheng xu huo mian te quan 。,di san tiao bing mei you fu yu lian bang fa yuan jie jue nei bu zheng yi de quan li 。,di er tiao bing mei you fu yu zong tong zai xing shi jian kong zhong ju jue gong kai zheng ju de jue dui 、 wu tiao jian de te quan 。,D,professional_law,law
